Content,Date
"Worst place ever, the food and souvenirs are too much money and the staff are rude. I had to wait a whole hour in almost every line for the rides, and they weren't even fun! Since Disneyland already takes everyone's money from the tickets to get in, they should lower the prices of the souvenirs 🤦 they were so expensive for something that costs $2 to make. I DO NOT recommend going.",2023-01-07
Chimichangas were hard as rock and Churros were way too crunchy and no soft center. I have been to Disneyland about a 100 times and these food items are not the same as they used to be from when I last visited back before the pandemic shut down. Please bring back the old way you used to make your churros and chimichangas. I don’t care if I have to pay .75 cents more.,2023-01-05
"Not happy with our experience. Spent $ on the Genie + pass for three people and only got to use it on two rides. Was cut in stand by lanes. They did end up refunding us with a Disney gift card, but I had to reach out to a completely separate department than the ones listed on the site and it took weeks to gear back maybe even over a month do to how busy they are.",2023-01-07
"A great time! It always manages to make you feel like a kid again. The music stays with you but in a very subtle way. If you plan it right you don't have to spend a ton of money once you get in the gate to still have fun. I wish Genie+ was set up a little better, I think Fastpass we were able to do a lot more with. Lots of neat places to just hang out and enjoy.",2023-01-07
"Il primo parco Disney, inaugurato da Walt Disney in persona nel 1955. Nonostante si dica che Disneyland Paris sia migliore, credo che un appassionato Disney non possa perdersi anche questo parco, infatti molte attrazioni sono comunque differenti ed esclusive. Imperdibili: Incredicoaster, Indiana Jones adventure, Radiator Springs racers e Matterhorn Bobsleds",2023-01-02
It actually was quite nice not overcrowded no shoving and pushing I am in a wheelchair now and it was quite easy to maneuver getting on to the rides the workers were very helpful and getting my wheelchair onto the rides and getting them off it was amazing I didn't think I'd be able to go on anything and I was able to do the Haunted Mansion and small world,2023-01-01
"Disneyland is my official bonding place with my daughter, yes it gets crowded and lines are long, but the experience with characters, rides and fireworks are always good. Purchasing the annual pass is a great idea for us, we go atleast once a month or every other month. The savings and discounts from having an annual pass makes up for the upfront costs.",2023-01-03
"Disney is Disney, always a nice place to visit every once in awhile to see the new changes and relive your childhood memories. Service is always excellent in the Disney parks and so is the cleanliness. Wait times can be a bit long. Top attractions can easily be a 2 hour wait, but that should be expected especially when visiting on more of the peak days.",2023-01-06
"Happiest Place on Earth. Wish it would cost less though. Always prepare before visiting since it can be overwhelming. Aside from that, it is very fun! Lots of nostalgia and new visions from the future. I recommend Indiana Jones, Haunted Mansion, and the Star Wars rides. Food is also very good. Try out the Rose Tavern restaurant! Very good hamburgers.",2023-01-07
It Disney and for me it was Star Wars that I really wanted to see since I was 50 years old and grew up with Star Wars has my favorite movie of all time....I brought my 6 year old with my Wife and I...We went for Thanksgiving in 2022 and the weather was perfectPROs:Its CleanWas organizedLots of ActivitiesCONs:Gene is lameCrowdsExpensiveWait Times,2023-01-03
"What can be said about Disneyland that hasn’t already been said a million times? Plan your visit accordingly, hopefully on a slower day otherwise you may not be able to ride a lot of rides. In terms of theme parks, Disneyland is the gold standard. Every nook and cranny of this place is themed to their respective “lands.” Very immersive",2023-01-05
"The atmosphere in Disneyland was just soo amazing. It was something that you have never before experienced. There were soo many different attractions and places to go. The food here was wonderful but it was very expensive. Most things at Disneyland are though. Done of the lines were VERY long, but most of them were worth the wait",2023-01-05
"We had such a great time! The only thing that made this experience a little unhappy was how rude the employees were. For being the happiest place on earth, they need an attitude adjustment because they were not expressing happiness at all and this was every employee I encountered. Just plain rude and lack of customer service.",2023-01-07
"Disneyland is a magical place for people of all ages, with rides, shows and attractions that are sure to bring a smile to your face. It is important to purchase tickets in advance, arrive early, and take advantage of fastosa system. Be sure to bring a water bottle, sunscreen and comfortable shoes. Most importantly, have fun!",2023-01-03
"A ride stopped, than we couldn’t use the lighting lane. We did ride a canoe that was theee best part ….. honestly buying the lightning lane is great when rides work !! The ran out of happy birthday buttons … and didn’t even wanna help try to find one In a neighboring store on Main Street to it was only 8:30. Not nice!",2023-01-07
"How are you going to charge $200 dollars to go this stupid place and then close Adventureland without telling why? ""Theres an activity"" isn't a reason. Not to mention literally every ride broke down at least once. Also, half the employees are jerks who are rude for no reason. The other half at least are nice people.",2023-01-05
"We are from Los Angeles it's not like we go to Disneyland every year, it was my wife's birthday, got turned away, area code racism, we are disgusted, they give priority to people who are not from Los Angeles, I know I am just one more person in the world but now Your happiest Park turned out to be racial 👎👎👎👎👎",2023-01-06
Para quienes van recomiendo comprar los boletos con tiempo y desde la app. Ya en el lugar a mi me costaron 184dlls con tax cada boleto y desde la app salían en 109 porque fuimos entre semana pero por un problema con la app no los pude comprar.El precio del estacionamiento varía pero el más barato es 35 dlls.,2023-01-02
"10am “We’re full. No more tickets.” “Wut?” “You had to buy them online” “since when?” “2021” “I haven’t been here since 2019, how would we have known?””(smug shoulder shrug)”I get now why there’s a whole online universe of anti-Disney content.Oh welllll. We ended up having the best day in Old Towne Orange.",2023-01-07
As of today 10/11/23 two rides had shut down.  They evacuated us from hunted mansion to reopen the ride 15 minutes later. Indiana Jones at about 945pm. Just when i was about to get on the ride. I had purchased the lighting pass and they offered it with every closure. Well I already had it. So annoying 🙄,2023-01-03
"Disneyland California is simply magical! As corny as that sounds, the park does everything it can to bring you to a different time and place. Huge props for the Genie+ service, it made it so much easier to plan our day, reduce wait times and collect all your photos. Definitely worthy the add-on.",2023-01-03
"Es la peor experiencia que eh tenido en mi vida,se volvió un lugar donde tienes que pagar para todo,si quieres ir rapido en la línea pagas,te  ponen cierto tiempo de espera y se hace el doble,no sean aprovechados,ya no es un lugar de sueños ahora es una pesadilla,la verdad nunca vuelvo a venir",2023-01-07