Content,Date
Toy is so amazing she helped us out and was so Patient with us !!!! I recommend coming here and with her !!! Perfect customer service !!!! Will be coming back again,2023-01-02
Friendly and knowledgeable staff.  Customer service is top notch. Products are displayed in an open and easy to navigate floor plan. I highly enjoy this dispensary.,2023-01-05
"Great selection of products and a fantastic staff. Justin and Victoria have always been kind, patient, and have provided great etas and updates during deliveries.",2023-01-07
Friendly helpful staff.$13 8ths these are totallyrespectable & acceptablefor a happy haze hour!Me & Sidney (Chihuahua dgf{dawgeefriend}pic'd) wholly approve😁💯❣️,2023-01-07
"This place is bright, fun, and has a great vibe!  Prices are great, variety is insane, and the bud tenders are friendly and knowledgeable.  Wonderful experience!",2023-01-06
"This was a great experience. My 2nd time there and the service was just as good as the product. Thanks guys for the great experience. C u soon. From Houston, TX.",2023-01-07
Ryan and everyone in Planet 13 is so nice!!! Come here for the excellent customer service and great variety. Really recommend if you’re new to smoking tree 🌴🔥,2023-01-03
Had a great time here! First visit was cool they are very helpful! Ryan is very knowledgeable and chill to talk to! Definitely stop here if you have a chance !,2023-01-03
All of the sudden I can't get anything delivered they claim their too busy I been ordering for a while I guess that's going to change back to the Super Clinic,2023-01-07
"One of my favorite places to buy flower. It is super cool inside, the bud tenders are nice too. They have every brand like Stiiizy, thc design & papa Barkley",2023-01-06
"Always had good experiences with Planet 13, great deals and a friendly staff. Shout out to Justin on delivery for his great communication and quick delivery.",2023-01-07
Very clean thorough detail oriented. Excellent customer service. Highly recommend and will be returning. They have an excellent discount for new customers.,2023-01-05
"Best place in California and in Las Vegas.This is my one stop shop I come to often! Appreciate all you guys, y'all are very friendly and super helpful! 🤙",2023-01-04
Great service with detailed introduction.It also introduces beginners carefully and gives a lot of suggestions. The products are also rich and diverse.,2023-01-07
Disney Land of cannabis. Everyone was friendly and budtender very knowledgeable! The space is clean and organized. Wish we had one of these in Oregon!,2023-01-05
Planet 13 always coming through clutch. Justin was the man! Super respectful and professional. Great communication and got my delivery to me on time.,2023-01-07
David was very helpful. It's a huge place and a little overwhelming in a good way. Highly recommend. Update: second experience as good as the first.,2023-01-07
Pamelo Anderson in Bulk OZ was false Advertising. Showed us a Huge Nug and we got a bunch of really small nuggets. Didn't even look the same. Thanks,2023-01-08
"Wallmart shopthey don't need your moneyshop where it counts i guess...cool concept, Vegas oneis better. when cig companiessell weed they'll have it",2023-01-07
"This place is so cool! On-site parking, public restroom, gorgeous store set up, large variety of cannabis to choose from, and attractive merch.",2023-01-07
"Dangggg, this place is big! Bummer I wasted my first time sale on a pre roll but next time I visit I hope to grab more then just one pre-roll",2023-01-05
I was helped by Ryan and I received fast and efficient service!!!! The store also had a wide selection and great deals. 10/10 recommend!!!!,2023-01-03
This my favorite spot there varieties are always awesome. Everyone is so helpful and courteous. Definitely recommend this spot to everyone.,2023-01-03
Great choice of products. Excellent curb-side service. The driver Justin kept me updated on when he would arrive and give me a spot on time,2023-01-07
Freaking love this place! Definitely best customer service I’ve ever gotten. Ryan knows his greens. Never had a complaint about this place,2023-01-03
Planet 13 was the best. I had a really good time and bought some good green. They were most helpful with my visit with the fansatic Toy!!,2023-01-05
Wow! The place itself is an experience. The staff is super knowledgeable and took great care of me without me feeling like a total noob.,2023-01-07