Content,Date
 Great wipes Really like the amount I get for the price,2023-01-06
" Best for camping for all purpose use. I buy these by the carton because we go camping a lot and these work for everything! They don't leave streaks on the windshield. They work for every body part. I love that they're unscented. Went through different brands and when I used this one I never went back. Assuming they are good for babies as well but I've only use them on adult body parts, wiping dishes and windshields, etc. I always keep one in the car.",2023-01-06
Quick and easy These are the best wipes I've found for my babies. They don't irritate their skin and they wipe clean fast. If something is real stuck they have raised parts so you can just rub in a circle to release the stuff that is stuck and it's easy and painless. Highly recommend!!,2023-01-06
" High Quality These are thick, high quality wipes and they're cheap in price. I love huggies brand.",2023-01-06
 Best Wipes Out There These are unscented and even safe for babies to chew on if they want to. Thick and durable. I don't buy any other brand or kind because these have never failed me. Even come out of the package great 95% of the time!,2023-01-06
" Excellent product for the money This product is just the right thickness, and strong enough to make it worthwhile to repurchase. I am pleased with the item and will recommend it to others.",2023-01-06
"Not Just For Babies My son is 16 and likes to feel clean down there. They're also good for camping, especially cleaning underarms or clearing sweat from arms and legs to keep the mosquitoes at bay from the salt. Just DON'T FLUSH them. A plumber told me once - get ready for a $5000-10,000 bill if you do.",2023-01-06
 Good but an old batch different cases Good but an old batch different cases than you find at walmart. The newer style of lid helps them only come out one at a time. This is like an old style so maybe it's been in their warehouse a while I don't know but that's the only downside these wipes are amazing my favorite wipes you only really need one it clean so well,2023-01-06
 good nice,2023-01-06
"No smell or weird residue I had some issues with wipes smelling strongly of fragrances, or having some weird slimy/soapy residue. I did not feel comfortable using them on my baby, so I switched to this one. No residue, no smell, gets the job done. I also love that it comes in such a big pack that I don't have to think about buying wipes as frequently.",2023-01-06
"Wipe is fine, but can be hard to take out. I like that this wipe is thicker than others. They almost feel like paper towels and can be great for blowouts. I'm still torn on if the thickness is better than other natural wipes. My grip with this specific wipe and I bought 3 boxes - there were many packs where when you pull out one wipe, the next one does not come up beyond the surface like what you expect with tissues. Given some packs were fine, I think there may have been some quality control issues. This makes it tremendously annoying when you really want to pull for another wipe but have to use both hands to fish out the next wipe. Because of this annoyance that happened in multiple boxes, I'd wait till after the QA issues to buy more",2023-01-06
 Convenient for stocking up and taking along! These were advertised cheaper than I paid a couple weeks later. They are so convenient when traveling and adults can use them too! Baby has sensitive skin so it was important that I purchase unscented formula.,2023-01-06
These come in handy for wiping just about anything! everything. I even wipe my floor up with these.,2023-01-06
" Bought them for the husband and the sleep machine My husband got a sleep machine last year and was advised to cleanse his face before putting on the mask every time. Baby wipes were suggested. I have bought an assortment of one brand or another over the past year. These Huggies wipes with Mickey Mouse on the front seem to be his fave. He especially likes the clasp on the pouch that holds the wipes because it really holds so the wipes don't dry out. I looked on Amazon and found this bigger box deal with eleven pouches. They came USPS, in the Huggies box with Mickey on the outside, so the mail carrier and the whole neighborhood knows his ""business"" because they weren't in an unmarked box. We have no grandchildren. Obviously, he has so little to worry about in his life!",2023-01-06
 EXCELLENT! I bought it on sale and the brand is great for my newborn baby or for me.,2023-01-06
Does its job but surface is a little rough Great shipping fast shipping! As far as the product I got it for a great price but on a child's bottom you must be careful because even though it cleans well the surface is a little rough,2023-01-06
" Huggies wipes rule Huggies are the best wipes! As a mom of 4 I have tried so many and these are not slippery like some wipes are, but are still very soft. Huggies wipes allow you to get more ahem *stuff* when wiping because of their texture.",2023-01-06
" Excellent It's excellent, I love everything about it. Really soft, fragrance free, simply clean, I can use it to wipe my baby's face without thinking it will irritate him. It's just awesome. Love it 😊",2023-01-06
 Always trust Huggies 💯 Can not go wrong with any Huggies products,2023-01-06
"Our favorite wipes, but for the 3rd time we've ordered and it's missing an entire pack of wipes I'll start by saying I NEVER take the time to leave product reviews. However these are our favorite baby wipes and we have tried them all! My son's skin is incredibly sensitive and we have never had an issue with these. The only thing that has held me back from a 5 star review is that for the 3rd time in a row I have ordered these wipes and they have arrived at my home missing an entire package from the box. Mind you Amazon has remedied the situation every time. It just becomes such a nuisance that I never get exactly what I ordered the 1st time. Other than that we love these. I have always found them gentle, soft, and easy to use.",2023-01-06
 Cleans without irritating Good on kids skin and cleans well,2023-01-06
" The BEST wipes After trying every wipe on the market over the last 15 years of parenting/foster parenting, I can say with confidence we will stick with these! They're the best!",2023-01-06
Simply Clean - enough said Huggies simply clean baby wipes are a must at our house. We use in the restroom as well as for small messes throughout the house and even keep a pack in the car. The 11 pack box is a great deal with the price for just 1 pack being $2.65 now at the Dollar General!,2023-01-06
 Package was opened. Missing items One flap was opened and missing a pack.,2023-01-06
 These aren't what they used to be When I had my first baby five years ago these were awesome! They were my favorites no smell worked great and never any issues so when I had my son I was sure I would use these again but they have changed something in the manufacturing process they are thin they don't clean as easily and they tear!!,2023-01-06
 For my taste a little hard They are not bad nor did they hurt my baby. But they're not that smooth,2023-01-06
" Love these! These are a life saver. We buy these for personal care wipes not for baby wipes. Really good price, unscented, and has been great for my sensitive skin",2023-01-06
"Best wipes for baby skin I am very impressed when I used it on my baby…I am sure it's for baby sensitive skin, it's very soft and scent is good too",2023-01-06
 Great product for baby and elderly adults I love this product I have used it for years on three generations,2023-01-06
 Cheap Cost effective! Cheaper and more for your money,2023-01-07
" These are durable, too. My little fur-baby often wears dog diapers, and I use these to clean his fur when I change them. I also use these for cleaning my apartment. I wipe down my furniture with these so the accumulated dust stays out of the air! I've tried other brands, but they lack the durability of Huggies. These never tear while in use! Great for cleaning my dog and my apartment!",2023-01-07
" Unsented No smell which is great. Thicker than most wipes, however, a little on the dry side. Could use more moisture during the making of this product. Will probably buy again.",2023-01-07
 Box was open and wipes were missing. Box was open and wipes were missing,2023-01-07
The only wipes to buy Huggies for us can do no wrong. We love their products.,2023-01-07
 Cheaper than most wipes with regular coupons Cheaper than most wipes with regular coupons. They work good. Just don't let your littles tear them up in pieces lol,2023-01-07
" Problem fixed! Size, scent, moisture level, toughness, doesn't dry out after opening. Mother, daughter, granddaughter, grandson, and great granddaughter approved!",2023-01-07
" Favorite wipe ever! I think I've tried every brand of wipes out there over my almost 2 decades of having babies and these are by far my most favorite! Durable, strong and you don't need as many as you would need with other brands.",2023-01-07
" Very good product! They serve their purpose well. I love their container, because they stay moist for a long time. I wish they had just a very light scent, but understand why most prefer no scent.",2023-01-07
 There not that sensitive My son has eczema and it still irritated his skin including when he'd get diaper rashes,2023-01-07
"Great Wipes Would Recommend I love these wipes so much, they are a great price and product. We use these for face, hands, and bottom! They are perfect for our needs and we love them!",2023-01-07
 Best Wipes! Heavy Duty for small and large messes,2023-01-07
" An off grid must have. We chose these wipes because they are not scented. We use them for quick wash ups. Faces, hands... they are affordable for what we need. No infants here.",2023-01-07
 My grandson love it no rash I am good with it because my grandson do not have no rash,2023-01-07
" Cleans well & disintegrates well This is the first time buying this product and was blown away by the cleanliness that this wipe brings and also the moisture being intact even if you forget to close the mud of packet. Also, found that this is somewhat easily tear up paper when you pull with force which is good for environment as it disintegrates fast.",2023-01-07
 Missing a pack Carton arrived with one of the packs from inside missing.,2023-01-07
"Will always buy back. I need it, I need to use it to clean my child's ass every day. I will always buy it back.",2023-01-07
" I used to love them, but not so much anymore. These wipes have always been a little more rough (less soft) than some, but we've used them for our twins more than any other brand. They seem to do a decent job compared to others at their price point. However, they have changed. The wipes themselves seem to have become more rough and less moist, and we hate the new lid on them. The lids were oval and decently sturdy, but the new ones are round and very flimsy. I have to make sure they are out of reach because my twins have broken the tops when trying to open them. The plastic is thinner and they are harder to open than the old ones. I'm not a fan of the wipes today, but I used to recommend them (the old version).",2023-01-07
 Quality Wipes Good for sensitive skin,2023-01-07
 Love them Great wipes,2023-01-07
Huggies wipes for anyone! I love having Huggies wipes for my family. Put them in the car for a quick clean up. Remember Don't Flush them. Great size and no smell just a clean feel. I started buying them for a quick clean up at camp and there good for anyone. I like to buy them by the case. They make a good gift for a baby shower with Huggies Diapers! Definitely recommend you buy some for yourself.,2023-01-07
" DurableVery durable. Cleans well and stays together which are my main concerns. These have been our go to for all of our children. We haven't had any issues with sensitivity in our children, but as always, all children are different. I have no issues recommending these to most anyone.",2023-01-07
 The packages keep ripping The packages kept ripping open in this case. Never had this issue before.,2023-01-07
 As described. Great price and value.,2023-01-07
Sturdier than off brands and cleans well. I use in the bathroom and for doggie and cat cleanups. Work well and a good bargain. Better made and better dispensed than most off brands I have purchased.,2023-01-07
 Hands down the best wipes These wipes have been the best wipes I have ever used on my babies. I've used other Huggies brand but they are really soft and rip easily.. these are thicker and last longer.,2023-01-07
 Perfect wipes for adults I use a dispenser for them that sits atop the toilet tank and before adding any to the container I spray the sides with cologne or a roll on perfume to give them a great aroma while using. I have these on subscription so I don't have to schlep them from the grocery store. Win/Win!,2023-01-07
"My favorite wipes that I buy over and over again. I live in a personal care home and unfortunately where adult briefs. I like that they have no scent because the perfumed ones irritate my skin. What is so weird is that I have paid as $30 for one box of 11 when I was desperate. Seems I pay a different price every time and can't always get from the same seller. Makes buying them rather difficult and often I have to wait more than two days for delivery, sometimes 2 weeks. There is another brand I like but they are sold out almost every single time. So now I order several boxes just to make sure I don't run out. I usually go through two boxes a month. Mostly because the nurses get carried away with using the amount of wipes. I'm always telling them to take it easy because it's not their money and they don't need to use that money because the wipes are really quite sturdy and do the job with just one or two.",2023-01-07
"Worth the price! Definitely worth the money. I love these wipes, they are wonderful. Will be buying again.",2023-01-07
" Soapy wipes The wipes are soapy, if you squeeze on you can see the white bubblie liquid come out. It leaves behind suds almost like soap lathered up and they are super wet so you feel like you have to wash your hands after. The only thing I can compare it to is soap. Definitely not something I want to wipe and leave liquid on my babies bottom with. They are good for wiping hands, feet, and cleaning messes up with though!",2023-01-07
 Best wipes around Love to use these no scent great for sensitive skin and can also be torn into if needed,2023-01-07
Good value. New and improved pop top design. I love the pop tops on these. The design feels very improved from previous plastic pop top designs from this brand. I have a lot less dried up wipe packets from these wipes with the new and improved design. I think they are a good value for your money. The thickness is really good on these too. Added plus that the kids have not had any negative reactions from this brand. Overall I'd recommend them.,2023-01-07
 Good value Its a good value for the money.,2023-01-07
 Gift Bought as a gift for my expectant niece.,2023-01-07
 Don't like them. I didn't think what Huggies wipes I bought would matter. Apparently I was wrong. I definitely prefer the natural care Huggies wipes! These are hard to get out and you end up tearing them.,2023-01-07
" good but not the best these are decent wipes, not my favorite but it doesn't matter much to me I just look for deals and this happened to be on sale",2023-01-07
 Good soft and sturdy smells nice Good,2023-01-07
"Good wipes - great value & price. For the price, it's a no-brainer. Even the Amazon brand wipes are more expensive than these brand-name baby wipes. I purchase them for home use and they also for donations to food pantries who distribute baby items. You get the most for your money! Highly recommend. Wipes are soft, but break easily. Unscented. Don't pull apart.",2023-01-07
 Good product and value Good deal and quality.,2023-01-07
 Good deal & product met expectations Product met expectations Good deal,2023-01-07
 Soft Soft and smooth product not to cold and wet,2023-01-07
" Great One side of each wipe is slightly scratchy when used on my face. That's pretty standard for this particular type of wipe. If you plan on using on faces, I would get the shea butter Huggies or the special delivery Huggies, which I believe is unscented as well.",2023-01-07
Best wipes! I love these wipes. They're soft and durable. No scent which is great for sensitive skin. We use these for everything. These will not burn sensitive skin caused by diaper rash. Other brands that are “sensitive” have a funky smell which makes me wonder what's in them. And they burn the skin. These have absolutely zero smell!!!,2023-01-07
 Value product Bought these for my grandson. Daughter loves how gentle they are on baby's skin. Great value product,2023-01-07
 They work Don't stay moist long enough after opening,2023-01-07
" Best wipes you can buy In our house, we have tried many different brands of wipes, used to clean your butt after you go... NONE of them compare to Huggies unscented baby wipes. Amazing cleaning power and you won't have to reach for another because Huggies wipes are huge compared to competitors, like Pampers. Try them, you'll like them.",2023-01-07
 Nice Good for newborns,2023-01-07
" Huggies wipes for all uses Convenient packaging, good value overall win.",2023-01-07
"Good And Clean Great product for the price, so I will be ordering again once the time comes.",2023-01-07
 Does the job We use these like the duck tap of motherhood. It fixes everything. I keep a pack in the car and in the bathroom. We also use it for our English bulldog because that breed can get messy in that area. It is very gentle and moist enough to get the job done.,2023-01-07
" First package didn't arrive! Seller sent replacement Promptly We use these wipes since our son was born and still today- he's 5! He has very delicate skin and we never had an issue, they clean well, smell nutral and don't tear when heavy duty :) they make our life easier after we tried SO many over the years - we always return to our box of these wipes! I like the amount in a single pack, the cap closes well (while the new round design doesn't close as easy and perfect, and the plastic seems thinner - I wonder If those wipes are meant to go in a refill box",2023-01-07
Highly recommend these wipes I highly recommend these for any size/age of child.,2023-01-07
 Great The wipes came early and great price just wish huggies made the wipes softer,2023-01-07
 Best wipes I've used these since my daughter was born and no rashes ever,2023-01-07
 No rash It does not irritate my grandson's sensitive skin and cleans well. It gets the job done and comes in handy for other small wipe ups!!! thick and durable,2023-01-07
" Great other than they tear easily Honestly Walmart parents choice brand is better, because they don't rip apart. These are great for sensitive skin though no issues there.",2023-01-07
"Perfect for artisans and painters! I am an enamelist and glass enameling powder is used. I use it to keep my work station as sanitary as possible Also used for sanding/grinding edges of metal, wiping down as I go.Secondly am a painter and these are also wonderful for in between brush cleanups before the water basin.Also keep a PACK IN KITCHEN - Wonderful for kitchen small kitchen spills. Yup one in garage. Easier than running back in the house for a wet rag! Love 'em! Bathroom - for sure. So I'm loving MY HUGGIES!",2023-01-07
" Nice price but the wipe breaks easily. Overall it's good. Just when you take the first few wipes, it breaks easily.",2023-01-07
 Best deal I had found. Bought cause of the deal available at the time and to start stocking up for the new baby coming.,2023-01-07
" Come on now... it's Huggies Love getting these in bulk, cheaper and less trips to the store.",2023-01-07
 Nothing makes you happier than a FRESH BOTTOM❣️ .•°•.•°•.•°💥NO MATTER HOW OLD YOU ARE!!,2023-01-07
"Great deal. Won't find a better wipe. I enjoy all of the Huggie wipes. Depending on who I'm using the wipe on. If it's on a child under 2 years of age, I fr rather use the scent less wipes . If child is older I like the baby scent or the coconut butter scent.Trust me You will enjoy the c",2023-01-07
 As it arrived Great for personal use,2023-01-07
" Very durable and strong! I like the durability of these wipes for my toddler cuz he is always getting messy but the one thing I wud change about 8t if I cud wud have to be the roughness of them, I really wish they were alot softer.",2023-01-07
 Specials Very practical,2023-01-07
 pricenice box nice box,2023-01-07
" Good They work well, not my favorite, but close",2023-01-07
"Quality no scented baby wipe This quipes are the best. No scent, easy to pull them up, nice packing. Perhaps the company can do them softer. It has great thickness so that you don't get poop on your hand. The price reflects that, but overall is not too pricey. No allergy or diaper rash with the use. Will purchase them until my baby is done with the diapers.",2023-01-07
" Good wipes, rip easily (low quality) The wipes rip when you pull them out of the dispenser. It's not the worst thing but it's definitely annoying. Apart from that they're great for an entice skin and they don't have a bad smell at all - a scented really does mean unscented.",2023-01-07
" Good, tears kinda easily Often tears easily when pulling out of package",2023-01-07
 Good Pretty good wipe,2023-01-07
 Best wipes These are the best baby wipes I've sued. My son was breaking out from other wipes so I tried this. The only con is it rips like tissue paper.,2023-01-07
Great Wipes! These wipes are unscented and have no smell. They clean very well and have been great for baby skin.,2023-01-07
" Not just for babies anymore I have read that baby wipes are the salvation for the elderly, I love that these come in a product that does not cause my sensitive skin to rebel. And I am preachin' the baby wipes gospel to all my old time friends who complain that toilet paper just doesn't do the job anymore. Added bonus is that they are usable for a moist wipe for other things too. Just do not flush, you will need to keep a waste container near the commode to save on plumber bills. Added bonus, your finger wont poke through when you wipe.",2023-01-07
 baby wipes these are better than other wipes we've used. great price,2023-01-07
" missing pieces package came with with 2 missing packs, the top of the box was open",2023-01-07
 LOVE Well worth money. Adults use these in my house. Will buy again.,2023-01-07
 good good,2023-01-07
"Practical These are great for the price, but I don't think they are as good as the sensitive Huggies wipes. They can be a bit harsh for my daughter's sensitive bum. So I don't plan on buying these anymore for her. However these would be great for adults!",2023-01-07
 Great value! We use a lot of baby wipes in this house. The large package is great!,2023-01-07
" Scent free, easy to clean love this",2023-01-07
 Very fresh smell These were great and smelled clean and Fresh,2023-01-08
" I would have given 5 stars but my order was late so I deducted a star The product is exactly as advertised and is a quality product, I really enjoy how well this product works, I just wish my particular order would have arrived on time",2023-01-08
 Great! Love when these go on sale! Great wipes!!,2023-01-08
 Very fast Very good,2023-01-08
 Nice price Very suitable for daily use at home,2023-01-08
" Favorite wipes! Perfect size, durable, and they come out individually with ease!!!",2023-01-08
Nice and easy Easy to use and manage on the go. Better and more simple than the refillable tubs at home. Don't have to worry about wipes drying out. The wipes are soft and no scent detected so it's nice not to worry about my little one not breaking out in a rash.,2023-01-08
 Quality great fast shipping Loves these wipes,2023-01-08
" Love it! This is my favorite wipes.. I use it for a lot of things- great to remove make up without breaking out. Delivery was on time, definitely purchasing again from this seller.",2023-01-08
" Huggies is my brand Huggies has always been my families go-to brand and now starting my own family, they are mine. Loyal to this brand of Huggies because they are on the cheaper side of disposable baby products. I love that there is no smell to them as I have a sensitive nose. They do the job. And they get my Fetch point rewards.",2023-01-08
Disappointed that the next wipe doesn't pop up Quality is great but I am disappointed that the next wipe doesn't pop up especially when you have a messy diaper clean up and need multiple wipes.,2023-01-08
 Great value Love this product and when I found this bundle for the price I couldn't pass it up.,2023-01-08
 Review The smell is kinda blah,2023-01-08
 Super soft These are super soft wipes that don't irritate my skin. They don't really have a scent so that's great to me. The only thing is they are easily turned.,2023-01-08
 Works great I use for many things around the home,2023-01-08
" Best wipes ever I have the monthly subscription of this & these are the best wipes! You cannot go wrong with them, they're soft, durable & unscented. Definitely the best bang for your buck, you cannot go wrong!",2023-01-08
 Fantastic Great strength combined with gentle softness. No scent. Love it.,2023-01-08
 Just as described Nothing wrong with them. Great deal I got on them too.,2023-01-08
"Not as soft Not as soft as the other Huggies wipes in green packaging, but does the job",2023-01-08
