Content,Date
" affordable quality I am a very careful and price wary shopper. We don't have kids in the home but we use wipes. Most companies now offer ""personal wipes"" that are super expensive. Baby wipes are the same thing for much less! Our city has old outdated sewers and we do not use paper at all. Having baby wipes is the best way for us. I usually buy Huggies wipes in warehouse stores but Amazon has a great price on a case at a time so I set up a subscribe and save on them. Huggies are soft, very lightly scented and are the right size and protection. I think they are the best wipe out there! I highly recommend this well made soft baby wipe for any person or family.",2023-01-01
"Good value but not for sensitive skin. Wish it was JUST WATER! I liked these for a while because of the insane value but my babe started getting bad rashes recently anytime I use them. When I switch to M@ma Be@r water wipes, rashes heal quickly and don't recur... as those wipes are just water and are super soft. These are not soft, but are quite thick, so I dry them out and use them as dry wipes for absorbing purposes around the changing table instead. We went through a case with no issues before, but I guess I'll go back to the Water wipes to avoid rashes.",2023-01-01
 Great product Baby has sensitive skin. These wipes do not break her out like others have and that's such a relief,2023-01-01
 Great on baby skin Bought it for my friend gender reveal but i personally use it on my 1 year old that as eczema and it caused no irritation,2023-01-01
"My favorite wipes! I love these wipes for my 5 month old son & my 2 year old niece. I love the easy large flip top, and that these are unscented. Aside from diapering usage I find these great to quickly clean my baby brezza formula pro formula dispenser, the funnel and dispensing hole need to be cleaned every 4 bottles and these wipes are such a life saver to use to wipe the dirty parts clean!",2023-01-01
 Softness Great for smooth comfortable feel on your butt. Definitely soft and really keep the bottom nice smooth and clear.,2023-01-01
 Good wipes Good wipes! Was in a pinch so I bought these till I can renew my membership at sams club.,2023-01-01
 Need this a need,2023-01-01
 Great buy Baby has sensitive skin. These wipes do not break her out like others have. Not a bad value for the number of wipes received.,2023-01-01
 Good value for the money I love Huggies wipes. They are definitely worth it especially this amount for $18. They work good on my son.,2023-01-02
"Soft thick and smells good. I use it daily instead of toilet paper due to sensitivity, works great.",2023-01-02
 Not for Newborn Not soft enough for newborn baby!!!!,2023-01-02
 The best quality for your $$$$ These are the best quality and durability of any wipes I have found. I just wish they had a scent.,2023-01-02
 Good Satisfied,2023-01-02
 Soft Nice and soft on the skin.,2023-01-02
 Good product Good product,2023-01-02
 Everything arrived very well Super pleased I arrive in 3 days Everything in perfect condition,2023-01-02
 Baby Wipes For: Baby,2023-01-02
" Excellent wet towels for children. Good wet towels, good price, very useful for children's daily use.",2023-01-02
 repeat purchase repeat purchase. good value for price. huggies are the superior wipe brand,2023-01-02
 Can never go wrong with these! Perfect quality - amazing product,2023-01-02
 Most useful recommend for babies and anyone else who needs these. They are large and firm enough.,2023-01-03
Won't buy anything else! Keep going back to this Brand! It's perfect and wipes are soft and always wet and don't dry out that fast! Sensitive is the only one I will use and this price is still cheaper than in stores. It always arrives early. We use a wipe warmer so the Individual packs are great sizes!,2023-01-03
 Dry Those wipes are little dry,2023-01-03
 Baby Wipes GREAT wipes for babies and adults.,2023-01-03
 Bulk wipes for decent price We use wipes alot in our house my 4yr old uses them sometimes when wiping after using the bather I also use them to clean her face and we put a lot up for when we have our 3rd baby in April. If you want to bulk buy wipes to stock up this is the way to go,2023-01-03
 As expected Quality is as expected. I enjoy the subscription so I don't have to worry about finding them in stores.,2023-01-03
 Huggies Is My Go To! I love Huggies wipes! I love the thickness & the reasonable price!,2023-01-03
 Good value Good value for money. I dont have to be buying wipes often as it last.,2023-01-03
 good good,2023-01-03
"Great Deal!!! These are a common staple in our bathroom. We're adults, and it's nice to be fresh… always. These are thick and have no scent at all!! That's important too. Don't use pampers wipes… they burn like fire!! No wonder babies cry. Use Huggies, and in bulk is the way to do it!",2023-01-03
" Packed with moisture I love these wipes. They're the only ones I have found that maintain moisture that you can actually see on the wipe. It's nice because then you can use minimal. There is no scent to them. The only thing is that it holds so much water that sometimes trying to get them out of the pack, they tear and you have to fish the rest of it out. Not a big deal to me though, I'll continue buying these.",2023-01-03
 Soft cleanser I love these wipes. It wipes out all dirty and stain on baby body. The scent is very comfortable,2023-01-03
Tend To Tear I wanted to love these wipes. The positives are that they are fabulous for sensitive skin and are soft and thick. Unfortunately they tend to tear when pulling them out of the pack. I've had to resort to taking the few out that I need unfolded. This works but makes more work for me. So I'm of two opinions here or I would have given five stars. Maybe I'm just clumsy and you'll have better luck. This is a good value and Huggies is a champ when it comes to wipes.,2023-01-03
 Good deal 11 big packs of wipes for cheap,2023-01-03
 Huggies wips Arrived complete and undamaged.,2023-01-03
 Great product 11 flip top packages. I love this brand. Never had any issues with this!,2023-01-03
 good good,2023-01-03
" It is very good, huggies is the best brand, it is highly recommended 👌 I really liked this huggies brand because it does not harm the skin of a very sensitive baby",2023-01-03
 Amazing I loved it 💕 😍,2023-01-03
 Durable Durable and great value.,2023-01-03
 we all use it good for babies and adults.,2023-01-03
"Great diapers! Don't knock them, until you try them! Everyone should at least give them a chance. One of the only diapers I never had any leaks or blowouts with my daughter.",2023-01-03
 Great value and high quality! These wipes are perfect for everyday use. I always have a set of wipes in the common areas and in all of the bathrooms. I love how they don't have a scent and they are priced really well!,2023-01-03
 Wipes Love huggies wipes,2023-01-03
 HUGGIES ALL GOOD THE ONLY BRAND I USE,2023-01-04
" Can be obnoxious to use. They're wipes. They work fine as wipes. No purfume and they haven't bothered my daughter's skin. The ""obnoxious"" part is they constantly only give you one wipe without lifting the next wipe in the stack. This is extremely annoying when you're using one hand to hold the baby's butt in the air and only have one hand free to try and get another wipe out without grabbing 3. Why can't wipes makers find the balance between this and getting a nonstop string of wipes?",2023-01-04
Durability and softness Love the thickness,2023-01-04
" Great for Use on Horses I use these to wipe my horses eyes, injuries and private parts and the wipes work great. They don't irritate the skin and they are unscented which is perfect for horses and babies!",2023-01-04
" Durable, soft, and unscented. The Huggies Fragrance-Free baby wipes are durable and soft. They work perfectly every time with no ripping or excess mess.",2023-01-04
"Great for sensitive skin My almost 2.5 year old has very sensitive skin- these were/are a lifesaver for his little butt. The thickness is perfect (I HATE thin babywipes) and they are just the right amount of wetness. (Not to dry/not to wet). He is now potty trained but still poops In his underwear:( so we still use these wipes for cleaning up his butt. I also used them up until a month or so ago on my daycare kiddos (along with my 2.5 year old) for their face, hands, legs, feet etc (MULTIPLE wipes a day).I am auto subscribed every 2 months and would have 1 or 2 packages when the new box would be delivered.I however have been switching my home to chemical free products and have Got a few body cloths (reusable+machine washable) through my online business so I'm not having to use the wipes to clean off their legs, face, feet, etc anymore- which is also helping on waste.I will probably be able to switch my subscription to every 6 months now :) I am working on my last thing of wipes from my previous delivery. (Before I would have already started the new box).",2023-01-04
Great! These work great. I haven't had any issues with irritation or finding anything that wasn't supposed to be in the wipes. One box lasts me around 3 months. Overall would recommend.,2023-01-04
" Nice wipes at a reasonable price We have used these for all of our kids, one child was very sensitive to most other products. We also use these for general cleanup of messes as well.",2023-01-04
 Excellent product. It does the job and it's a good price.,2023-01-04
" Great price! Great wipes. This was a great deal on Huggies wipes. We use them all the time on the baby, plus for cleanups around the house and makeup removal.",2023-01-04
 Convenient and needed! I love having the option of no scent sometimes. My granddaughter has not shown any irritation or rashes using this brand. Thanks...,2023-01-04
"Great for faces! I no longer have babies, but I buy these for my face. They're great for a quick wipe before bed, after being in the yard, or mid-day refresh. The product does not contain any plastic fibers, which means they are basically water and cotton. When dry, they can be shredded and composted - most other wipes can't be composted. I have sensitive skin and have had less instances of clogged pores after using this. These are great for using at my desk, by the bedside, and even use them to wipe down the dogs after they come inside! Great to remove excess oil from skin, and I will continue to have these in my home for a long time!",2023-01-04
 Really thin Someone gifted us the Honest-brand wipes and it ruined all other wipes for us. Gave these a try but don't like how thin they are and they rip easily.,2023-01-04
"Something's different. Disappointed I have been buying this product for over a year now, approximately once every 2-3 months. This last box I ordered, something was different. They are very rough feeling on your skin and they smell like window cleaner even though they are supposed to be unscented. I'm not sure if they changed their product or if there is a bad batch, but the box, packaging and everything is the same, except for the texture and smell of the baby wipes themselves.",2023-01-04
" BEST QUALITY WIPES FOR PRICE Have been using these wipes since my kids were born. No complaints here. They're strong, durable and good for sensitive skin. I have a subscription for them as they're still good to have for the family to clean faces, hands and bottoms.",2023-01-04
 Durable Good price point. Durable.,2023-01-04
 Great diapers Fits perfect and great quality,2023-01-04
 Use auto delivery This product never fails. It arrives on time and is always what expected.,2023-01-04
 Great product Work great to clean everything,2023-01-05
Best value These baby wipes are the absolute best! They are strong and durable and are the best value I have found. They are good for sensitive skin,2023-01-05
" More economical than pet wipes... These are great for what I need them for. I have a kitten. He was a rescue and for as long as I've had him, despite antibiotics and other treatments, he has a crusty nose and eye every day. I needed something soft, unscented, affordable and thick enough that I didn't get stuff in my hands. This fit the bill. It may seem crazy to buy baby Wipes for a cat, but have you compared the cost of pet Wipes to these? 15 bucks for 704 Wipes. That means that if they don't dry out, and considering my own personal use of these in the car and on trips, I will probably not have to buy Wipes for at least a year. I was buying the little packs of 18 pet Wipes from Walmart for about three bucks every two weeks at least. Because they were so small, I sometimes had to use more than one. This was a great deal.",2023-01-05
Better and stronger These wipes are stronger and better than any other brand I've used.,2023-01-05
" Delivered fast Came quick, good price for the amount, though when you open the box, they had a spot for one more packet they could have put in and just made it a box of 12 instead of 11. I mean it is rather stupid to fill a box and leave one spot empty so it looks like one is missing just to keep it at 11. Just add the 12th one in and call it a day. An actual complete box. Price would be even better if they made it an even 12 for the box. But over all good deal, i just found that rather stupid when i opened the box and it was like well that is dumb.",2023-01-05
" Must have Must have item in your home for all types of purposes. From cleaning hands, face, surfaces, vents, and floors.",2023-01-05
 Cleansing Power The best wipes on the market. Perfect for sensitive skin. Great price.,2023-01-05
" Perfect Perfect, when you don't feel like going into the store",2023-01-05
Go To I've been using these wipes since my son was born and have never used anything else. It cleans well and it's very durable. And you can't beat the price,2023-01-05
 Dry Purchased 4 boxes in total. Each was dry when opened. Not completely dry but it was too dry to wipe a baby butt with and it was rough.,2023-01-05
"Work just fine! But if you look for softness try smith else. Revised in a few weeks: I added 2 more stars to this product, not because it became softer or thicker, but its durable and comparing price-quality - it works just fine! and if you don't rush they pull one after another also pretty good. I still believe its more for grown-ups. Initially: I was Very dissapointed. Its for grown-ups, because baby's butts wouldn't handle it. Im a mom of 20 month old twin-girls. Its very thin, very rough, and you will have to dig almost every other tissue, as they are not pulling one after another. I decided to save a few bucks, and regretted. (Better spend time and go for Kirkland tissues-price-wise and good quality, or spend an extra $$ for your baby's comfort). Will keep a full box for myself.(Lol! Good for hemorrhoids...)- still true.",2023-01-05
 Great Item as described,2023-01-05
" am satisfied as a whole. This is really good for the price. It's the cheapest and most reliable baby wipes I've ever bought. That's why I'm thinking of repurchasing it and recommend it. The reason I subtracted one star is that my baby's butt turns red when using wet wipes too much. I know it's because my baby's skin is sensitive, but I want even that to be solved.",2023-01-05
 The product is good but there were only ten in the box I liked the scent and softness,2023-01-05
"Wipes were good, box not so good These wipes are best I've found for ingredients for sensitive skin and for pulling out correctly. The wipes aren't soft though so I compensate by wiping softly. They aren't the strongest wipes either. I thought when I purchased the product it was reasonably priced. Both boxes it came in wasn't even sealed or even taped shut, so as to be open to spiders or germs or dirt etc, that is why the 3 star rating instead of five, hopefully that's not the norm. This is my experience with this product but may not be yours. Hope this helps",2023-01-05
 Thick wipes Glad someone can make a thick wipe. Some of them are horrible.,2023-01-05
" Small and thin. Go for bigger and slightly thicker wipes They're small. Bigger wipes like Huggies natural, pampers wipes. Rico wipes are bigger, thicker and cleans comfortably with fewer wipes",2023-01-05
"Can be difficult to separate wipes Overall great product. It's slightly annoying when one is stuck separating two wipes after working in attempt to only get one out. There's a strong dot of adhesive but let's be honest, just stick the other wipe back in the container until next time.",2023-01-05
" Great for your money This is a great buy money wise, but they are very moist. There are times I have to ring out the excess water before using",2023-01-05
 The more the merrier! You can never have enough wipes. My whole house uses them!,2023-01-05
" They are soft and get the job done! I get Fragrance-Free just in case my little guy gets a rash at any point. The wipes are soft, and the lid has never broken off (an issue I have had with other brands). So far very satisfied with this product.",2023-01-05
 Wipes Loving these wipes! They are wonderful in my daughters sensitive skin.,2023-01-05
"Best there is out there Huggies has and will always be my number one wipe. Make up, bathroom, spills, hands, face, animals, kids, adults and even counters or car seats. These are hands down the most Durable wipes I have ever tried and I have tried them all. Also they don't have a scent which I LOVE LOVE LOVE LOVE.",2023-01-05
 My Bum is happy I'm an adult woman who uses these after using the toilet. I feel super clean down there. I wish these were more moisturized like the pampers brand. I like how the wipes come out one at a time so I get the exact amount I want.,2023-01-05
 They work They worked,2023-01-05
" Huggie's baby wipes Best on the market, imo. I prefer the unscented.",2023-01-05
 Good alternative for the price when comparing These wipes are good when they are cheaper to others. They help do the job and have no scent. Might be but rough but cleans,2023-01-05
"Decent wipe Overall a pretty solid wipe. It was good at cleaning up the solids, but definitely could have been more moist. Baby had no bad reactions, but because it was a little on the dryer side I felt it was too rough if she did have any diaper rash. I did not finish the box and switched to the unscented Members Mark wipes which have been much better for my daughter.",2023-01-05
" An excellent value I have been using this brand since my now twelve year old was in diapers. I still keep these around in the bathroom, a pack in the car because you never know what might happen and a pack by the door for quick clean ups with my dogs.",2023-01-05
 No comments Baby wipes can't go wrong,2023-01-05
 Worth and last Love it last a good time,2023-01-05
 Good price They are soft and do not irritate the skin,2023-01-05
 gd all gd,2023-01-05
 My favorite It's so gentle for baby skin. And not to watery,2023-01-05
"Our Favorite Wipes to Use Huggies wipes are our favorite wipes to use in our house. They come out of the package easily with one hand. Everyone jokes that we only buy these wipes because of Mickey Mouse (we're a HUGE Disney family), but that isn't the case. We use fewer wipes in comparison to other brands. These wipes are good for the big messes and soft enough for cleaning baby's face after a fountain of spit up.",2023-01-05
 Only wipes we use! These don't irritate my sons sensitive skin and they work well.,2023-01-05
 Great Product N/A,2023-01-05
" As described I use wipes to clean my face at night before I sleep and after I wake up. I like these wipes because the way they're folded makes it easy to extract 1 wipe at a time, unlike some other wipes I've used that bunch together and you end up extracting more wipes than needed. I will definitely buy these again when needed.",2023-01-05
They have made the cloth size smaller. Quality has changed some. Size of sheet is definitely smaller and noticed that it is also not as thick as my last package that I'm still using up. I have 3 open in different locations. New shipment is of lesser quality. But still prefer this brand over the others out there.,2023-01-05
 This is the best price ever Nothing,2023-01-05
" Wet wet wipes Bought on sale for a good deal. They are very wet, and stick together more than the other brand we normally use. They are equally as gentle, which is great.",2023-01-05
 Very useful Bought these for my grand baby. They came very useful on my trip to Paris.,2023-01-05
 This was a gift. This was a gift. She loved all these.,2023-01-05
 Great wipes Good value. Huggies is only brand we get for granddaughter. These are soft and smell nice. Thick enough to get the job done right the first time!,2023-01-05
Best Brand of Wipes at a Great Price I learned a long time ago to buy wipes in bulk because they are a necessity in my household. I find this box with the 11 flip top packages to be the best bargain. Huggies is the only brand for us.,2023-01-05
 Awesome No rashes I really like them. There's other things I missed the return deadline for. I would have returned but not these. Good go baby & mommy,2023-01-05
" For everyone Love these wipes! Super soft when moist, a bit tough to use when dried up. Highly recommend not to leave the lid open after using them, it will dry up! Overall the only wipes I ever use!",2023-01-05
"No lint left behind This is the only wipes I will use. They have remained the same over time and when they did change them, they quickly went back to the old way. These do not leave lint on skin for Babies, Children or Adults. The thickness is perfect! Fingers do not poke through (a problem most wipes have, that is unacceptable for what they are intended for!). Bonus points because they are easy to tear apart, if you only need ½ a wipe! (Most usually shred and stretch when you try to rip it!) I and my Grandchildren have extremely sensitive skin and these do not cause any problems. Companies think its only the scent that bothers people ~ it is the materials they use that causes more problems. These are truly unscented, gentle BUT strong!",2023-01-05
 I use these for everything I have used these for decades for everything. They are THE BEST eye makeup removers.,2023-01-05
 Maybe not that good for sensitive skin I used them for my hands and they felt fine. But yesterday I wiped my face with it and I felt stung until now,2023-01-05
Easy to use Easy to use. I also keep them in my car for cleaning when needed.,2023-01-05
" The best wipes out there! I've used a lot of different wipes over the years with three different kids. These wipes are hands-down the best wipes I've found. They clean well, and are very durable. We use them for everything from baby butts to faces. (Not the same wipe though lol)",2023-01-05
"Durable/strong, but not soft My son had a red bum while I used these and they were rather uncomfortable for him. After a couple days of use he finally cried ""not those ones"" and it clicked as to why he was more upset at every diaper change than usual. I felt awful for not noticing. They are not very soft at all. They are strong and will hold up well, but they are a bit rough for delicate areas. He also freaked out when I tried these on his face. They are fragrance free, and don't smell particularly strong or anything but there is a slight unpleasant scent to them. I'm not sure if it was the scent or the texture/hardness to them that he didn't like on his face. (To be fair, sometimes he just doesn't like me wiping his face and it might have happened regardless of the wipe). I will use the remainder on myself or for other things, but not on my son. I thought it was a good value though, but my son needs something a bit softer.",2023-01-05
Best wipes ever My son has gotten rashes from other wipes but with Huggies wipes I have no issues.,2023-01-05
" Doesn't smell I don't like supporting a multinational company that generally makes toxic products, however, these wipes are my favorite I've found out of all the natural company wipes I've tried. The price is ridiculously cheap too. That helps. I keep these in all my bathrooms. I think they may be a little too rough for a baby's bum though.",2023-01-05
" Good value Value for money. These wipes are nice and thick, even Ted and large enough for an easy diaper change",2023-01-05
" A little rough These wipes are amazing, just would not recommend for sensitive skin as they are a little rough.",2023-01-05
 excellent excellent,2023-01-06
" I don't have a baby!!! I use these religiously......on myself. I do keep a pack in the bathroom but I also keep some in my car and bedroom. These are a life saver up camping. So many uses... wipe my hands, feet, face, clean the table, wipe down the dog. Possibilities are endless!",2023-01-06
"Awesome There thick, but what I like most, they pull up like keelnix. One at a time. No searching for the next one. Cheers",2023-01-06
" Definitely prefer other brands They don't hold moisture at ALL. They're very thick but they leave little tiny fuzzies on my baby's bottom. I end up using probably double the amount to get baby clean. The smell is okay I guess, but they certainly don't smell like they're unscented.",2023-01-06
" COMES OUT! Although I Don't like Disney, I could Not pass up the Savings😳 I go through 2-3 cases a week for a 23 year-old special-needs child that has a reaction to everything butHuggies wipes🙌🏻 Have to Save where we can, between Diapers, wipes, & Pads, we spend 300 to 400 a month 😱 just on those items🤯",2023-01-06
"The Best Baby Wipes I've used a lot of different baby wipes over the last few years, and these are hands down the best. I can't stand when wipes have that ""dry"" feeling. These have enough moisture without soaking my baby or myself. No weird perfume smells. Great for cleaning hands, wiping faces and cleaning spills in the car too!",2023-01-06
