Content,Date
" The Best I love everything about these baby wipes. I have been using them on my great grandchildren now for three years and they are wonderful. They clean them without leaving any after smell and they have never gotten diaper rash. Plus, I can use these without any scent to wipe their faces and hands. I highly recommend these to anyone. My granddaughter has sensitive skin also...and She has never broken out while we have used these. After I showed her parents what I was using and gave them a box, they won't use anything else.",2023-01-08
 FAVORITE wipes 😁 These work amazing. Pulls out one wipe at a time and not several. I love them. Will never use another kind.,2023-01-08
 Great If ur child has sensitive skin I highly recommend these baby wipes,2023-01-08
 I like 100% my favorite for my little boy. I love this product 100% my little boy soo happy with this wipes.,2023-01-08
 Love these wipes Love these wipes,2023-01-08
Great value for your money This is really great value for your money! Def worth it!,2023-01-08
 Best wipes ever! Originally I was a fan of Pampers because everyone told me they were the best for diapers and wipes. Until...someone bought me HUGGIES. I don't have to use as many wipes because these hold moisture even better and I feel like my son's bottom is cleaner!,2023-01-08
 Very thick wipes These wipes are very thick (compared to Pampers) and someone may like thicker wipes....just not my preference.,2023-01-08
 My go to wipes We love these wipes. My daughters have sensitive skin and these don't irritate the skin. No funny smell and easy to take the wipes out of the package. These are our go to wipes to buy!,2023-01-08
 Love Huggies!! It is wonderful for sensitive skin 😍,2023-01-08
" little rough These wipes are not as soft as other wipes I've used, even the Amazon brand wipes seem quite a bit softer. They have good moisture, but due to the roughness it feels like I have to wipe harder on my baby's sensitive little booty which I don't like!",2023-01-08
 Resistant and soft Good product,2023-01-08
" Not as pictured The wipes themselves are good—standard Huggies wipes, however, the packaging is different. I bought a case based on the picture of the package flip top going to the side. I have found the side flip top easier to use one-handed. When opening to the side, the package stays stable and the lid stays open. The case I received—all 11 of the packages flip top goes to the back (as pictured in my review photo. I am not happy about that!!! Either update the product photo, or ship the right product.",2023-01-08
 The softness For my 1 yr old baby,2023-01-08
Wish I would've known how rough they feel To me they seem rough but they do the job but when babes butt is rashed I gotta use a softer wipe.,2023-01-08
" Great deal I got a great deal on these baby Wipes. Any type of savings these days is amazing, especially on necessities for a newborn. I also received my order 4 days before the edd. Thank you!! 😍",2023-01-08