Content,Date
"Tons of games to choose from Great system.  My son owns one but has it with him at college so I decided to get one for myself and I must say it's got such a huge selection of games.  I still have my 3ds but didn't realize how much Nintendo had expanded on game selection and variety. I'm a huge animal crossing fan so I bought this version of Switch since I played the first one on the 3ds.  Their online eshop, accessible through an online connection, has an almost endless selection of games.  You can buy physical copies or digital copies of games and some are digital only through the eshop.  As a longtime gamer (I own a PS4 and original owner of a regular NES I bought in 1989), I can honestly say this is Nintendo's best system since you can play it on your TV but also take it with you (portable) like a 3ds.  You can also play games on it offline so you don't have to always be connected to the internet.  This is a console that is great for all ages of people, young or old and when I'm tired of hack and slash on my PS4, the Switch has many chill titles of games to relax with.  I'm 52 and enjoy mySwitch a lot.",1/7/23
"Beautiful Switch - Definitely worth the buy if you can find one Definitely love how bright the colors are on this switch, more of a neon pastel shade. The switch is the V2, which has extended battery life and a more efficient CPU. Comparing this switch the the V1, the IPS panel has a warmer tint whereas the V1 is much brighter. Though color values do vary across switches. The joycons themselves are more of a matte finish on the coating rather than the glossy feel on previous joycons. The colors match well with the dock and will definitely stand out by your TV. The dock itself is a bit wider compared to the V1 allowing more wiggle room to prevent the switch from being scratched, though I do recommend purchasing a glass screen protector. The pattern on the back of the switch definitely gives it an ""animal crossing"" feel to showcasing. They did a really good job in making the pattern stand out compared to previous special edition switches.Overall, pretty happy with having a new switch that stands out and has a longer battery life. Will definitely be a well-used switch in the coming months.",1/8/23
"Brand New Animal Crossing Edition Switch for MSRP For anyone looking to get an Animal Crossing Edition Switch without paying more than retail price, my advice is to be patient and check back here frequently. At random times, a few consoles will be restocked and available for MSRP (thank you to the other customers in the Q&A who tipped me off about this!). Just a couple minutes after coming across that advice, I refreshed the page to test it out and this is exactly what happened. Originally it said it would take over a month to arrive but I ended up receiving it less than a week later. Just make sure the listing says ""Ships from and sold by Amazon.com"" to ensure it's not a third party seller and that the price is exactly $299.99.In terms of the product itself, I had already been playing on another Switch for a while and it's a great console (aside from the infamous joycon drift issue). My preferred play style is docked on the TV but it works perfectly on handheld mode as well. The Animal Crossing edition is super cute with its pastel joycons and ACNH-themed dock, I highly recommend it!",1/7/23
"Fast shipping and great packaging First things first I got my Switch from Mums Collectibles & Stuff so this will mostly be a review of them as I've already owned a Switch and knew what to expect from the system.What most people don't realize is that consoles are in high demand this year (2020) and we all know the reason so I can't fault a company for increasing the price on item due to high demand and low stock of said item. That being said Mums Collectibles & Stuff is by far the cheapest I have seen a new switch go for on amazon, ebay or a number of other websites.On top of all of this one I bought the item from them they had it ready and shipped the next day as I did buy it rather late at night. With an estimated arrival time of 2 weeks I actually received it a week early which I give my thanks to UPS. When I opened the package I found they took the time to make sure that the switch was secure and safe with two layers of massive bubble wrap which was just extra enjoyment.All in all they are the cheapest, quickest and most reliable source to get a switch right now.",1/7/23
"Incredibly fun! Can also use parental control to track playtime and protect console from siblings I bought this just to play Animal Crossing: New Horizons, and it didn't disappoint in the least! It's incredibly fun!One cool feature is that if you set up Parental Control using the free app, it will tell you how long you've played each day. Since I'm neither a parent nor do I need to be controlled, I disable restrictions and play-time limit so it doesn't actually interfere when I'm playing, but it is a bit sobering to see that yesterday I played for 6 hrs and 40 min.Also, if you set the play-time limit to 0 min everyday, the console will prompt you to disable Parental Control via a PIN. This could come in very handy if you have a sibling or roommate who likes to steal your Switch.I would also recommend getting a screen cover, either plastic or glass. I have a glass one that adheres like a second screen and haven't had any trouble yet, but then again I've only had it for 8 days and treat it very carefully.Overall, a great product, and worth every penny!",1/8/23
"My son likes it My nine-year-old son saved and worked in order to buy a Nintendo Switch. He bought it with his own money and I couldn't be prouder of him. We bought the Animal Crossing edition only because it would have been available earlier than the standard version. He said he didn't care how it looked as long as it could play Switch games. Originally, Amazon delivered a completely unrelated package and said it was the Switch, but their customer service sent the replacement as soon as the issue was reported. Kudos to Amazon for that. My son has only used it in handheld mode since there isn't a TV available for his use. He has never placed it in the dock so I don't know how that would work. We've had it for a couple of weeks at this point. Here is my son's review:I like it. It's been good so far. Its most impressive feature is the battery life. One charge can last for six hours of continuous gameplay. It also charges more quickly than any other device I've ever had. It goes from around 4% to 25% in 10 to 15 minutes. I'm happy I bought it.",1/7/23
"One Year Later as a Switch owner I’ve had my Switch for about a year now and I can say it’s a very fun console. It’s no where near as powerful as the PS4 or Xbox but the fact that I can take my games on a road trip or play it at home is pretty awesome and convenient for gamers. The Joy-Cons do get loose however over time and will slide off without having to press the release button so I would recommend getting a grip or a case like the picture shown above. Another thing I wan to mention is the joy con drift, which can get really annoying at times. Having to calibrate them in the settings menu every other minute can be really annoying and for others, ruin the experience. I usually use a pro controller while playing on docked mode and I don’t run into any issues but the problem persists when I’m playing on table top or handheld. Besides the minor inconvenience here and there, I think the Nintendo Switch is great, especially with third party games like Skyrim or the Witcher 3 being ported over to the Switch. It’s a great little console.",1/7/23
"Beautiful console, reasonable price. This system is so beautiful and I got it for not too much more than the actual retail price! On top of it all I received it within days of ordering, picked it up early from the post office and I’ve played it at least once a day since owning it. The fact that it’s the updated version of the Switch with a better battery life means I can play longer on the go, and I don’t think a review of this version of the console would be complete without mentioning the gorgeous Animal Crossing New Horizons designs on the box and dock. The dock is completely white as opposed to the standard black, and features adorable artwork of Tom Nook, Timmy, and Tommy on a deserted island. The joy cons being a pastel green and blue instead of the neon I’ve grown accustomed to with my parent’s Switch is a great contrast. All in all this is a system I’d highly recommend if you love Animal Crossing and definitely something for a collector to pick up along the way! 100% my favorite special edition version of a console!",1/7/23
"Very beautiful, i almost shed a tear. Okay so this is going to be a review with my overall experience. Yes, it was overpriced, I think this was worth it, I personally got it for the Joy-cons, and I don't regret it, because you really don't know when you will get the opportunity to get one for less. Anyways, arrived in perfect condition, first switch ever, the only thing that was wrong is the Left Bumper on the Joy-con, which i don't know how to explain it but kind of loose, more than the Right Bumper. It bothers me because of something on the inside, and also since I paid a lot for this switch but not enough to complain, its just something i'll have to live with. But besides that, it was a great experience, the bumper was the only thing that gave me a fright since it feels very weird. Now I don't have anything to play since my game doesn't arrive until Wednesday, but just downloading free games is fun, but originally there is only 25gb so I would recommend getting a micro SD, but i think that's all.",1/8/23
"BEST B-DAY PRESENT EVER !!! We bought this for my 7-year-old son's birthday & he couldn't be happier!! This is by far the most adorable Nintendo switch console out there!! I definitely recommend purchasing it.We bought it when it was $300 plus tax. I do not recommend paying any more than that price.. just wait till it gets back in stock & buy it for $300. Do not purchase it from greedy scalpers.. keep an eye out because as soon as it gets in stock it sells out usually the same day! We are so fortunate we were able to get one in time for my son's birthday ..we purchased this back in October & held on to it till December for his birthday. If you want one for Christmas, I doubt you will be able to get one at the $300 price ..unfortunately it's sold out till mid January.. but if you can I say go ahead & get it! This thing is adorable & really is a great collector item for any Nintendo fan! Even if they aren't into animal crossing. It is a very unisex design. I believe it can be for a boy or a girl. 👍",1/7/23
"It's everything I could've ever dreamed of and more. I had experience with the Switch since my family had a shared one for a while, but sometimes you get tired of passing the console around so I got one of my own! I'm so glad I was able to get the New Horizons one because it's so much cuter in person and as an avid Animal Crossing fan since the 2001 Gamecube release here in the west, it's just so good. It took a while since this design is so popular but when I finally caught it during a restock period I knew I had to grab it!I love the color scheme, and seeing Tom Nook with Timmy and Tommy on a lil' island is so precious <3 The all around aesthetic makes it feel like both a console and an artpiece dedicated to your new journey on a deserted island.If you're a big AC fan who can afford to get it and you're able to grab one when they're in stock, I'd say to go for it. Nintendo most certainly knew what they were doing when they made this design because I had wanted this Switch since day one.",1/7/23
"Device not registering MicroSD Playing the games on this, has been fun and my son loves it....However, I've had this for SEVEN days, and I already have to send it into Nintendo for repair because the Joycons make a noise when using them, and the Switch does not register there is a MicroSD inserted. The internal device storage is terrible. And I had to even buy an additional MicroSD card to make sure it wasn't the SD card even though that SD works on my Nintendo Switch Lite, both SD cards do, but neither work on this Nintendo Switch. And if it's an issue that Nintendo cannot fix, they will only replace it with a used one that meets the requirements of a new one, even though the one purchased was brand new. The controller parts don't fit tight into the Switch, and the buttons don't always register when you push them so sometimes playing games is frustrating cause you push a button, and it doesn't work. Overall disappointed. Should have gone with a Playstation or Xbox.",1/7/23
"Just buy in a store!!!! I dont ever leave reviews but this is something else. The switch came and works everything is there but theres literally a blue line across the entire screen and is so annoying looking at it and seeing it while playing games. After three hours of being told to only return like i finally got one after being sold out for forever, they finally are going to just replace it but still have to wait two months for a replacement cause guess what? Sold out already! Thats better than not getting one at all though. Just glad after talking with 4 people they finally listened to my point of view. Really annoying and frustrating. Never buying electronics online again. Espically not from amazon.Edit: i got a replacement and the screen is actually not broken this time. Would still buy in store because of how hard it was to even get a replacement but i got one so thats all that matters. Console is great when its not broke and it is beautiful.",1/7/23
"Beautiful Special Edition! I got to admit, I was a little ticked off at Nintendo that the day this switch arrived at my doorstep, they announced the OLED Switch.That being said I am VERY happy with this purchase!  This console is beautiful and is a very nice upgrade to my launch day Switch that died last month.  Throw on a couple of pretty cases to help protect this and you have an amazing set up on your hands.  Nintendo has always made high quality consoles and special editions like this Animal Crossing Switch help showcase that very well.  Now even though the OLED was announced as well, it looks like the same specs just with a better screen.  Very nice for those who prefer handheld mode.  I use mine in the dock most of the time so I didn't really need that.TLDR: If you want a really nice Special Edition Switch then don't be dismayed by the OLED announcement.... the Animal Crossing console is very nice and well worth the money. 👌",1/7/23
"10/10 Recommend This is my third switch so that I can have three Animal Crossing islands because I’m insane, also I have severe ocd - same thing I guess?, and I am absolutely in love with the AC theme. I have a different style/color for each one so I can tell the islands apart but this one is def my fave. The Switch is my console. I have played a couple of games on ps4 (Atelier games that weren’t out on Switch until more recently), but now that those games are on Switch I will get them as soon as they go on sale. I love the handheld option because I can play while my husband watches something on our tv, and I love that it can also be docked so I can see things on the big screen. I play mostly handheld. It plays smoothly with the joycons and a pro controller. You can even play with a pro controller when it’s not docked if you don’t want to/can’t use the joycons. I’m sorry about the novella. It’s just enjoyable and I recommend it.",1/7/23
" love it I originally bought a Nintendo switch lite because this console was sold out everywhere and I desperately wanted to play Animal Crossing during this pandemic. I would literally check every month (since April) to see if maybe a store had this in stock, but sadly at the time, it was only third-party sellers selling at a huge markup price.By October, I decided to check one last time hoping that someone was selling at a decent price and to my surprise Amazon and several other retailers had this back in stock! Bought it right away because from my understanding this was supposed to be a limited edition item and didn’t want to miss the opportunity to own it.Got it in no time and I love it. It’s such a pretty color. It came around a good time since a lot of Switch games have gone on sale for the holiday. I still solely use my switch lite for Animal Crossing, but use my new switch for all other games.No regret purchasing it.",1/7/23
"Nintendo Switch #2 Here is what happened. I already had a Nintendo Switch but I didn’t play with it for a few months so when I wanted to use it it had no power. I put it on the dock to charge and nothing. I thought it was dead forever so I ordered a new one from Amazon. Later I went to see if my old Nintendo would power up after I charged it. What I was not doing is pushing in the power button enough, after I pushed the Nintendo powered up. So now I own 2 Nintendo’s. It’s great to have 2. This new NS works great just like the old one. I could care the less about the game Animal Crossing but I like how the NS looks. Also there was waiting time if I wanted the exact one I have. Over all the NS is great! In fact I like it better then Sony play Station or X-box I don’t even play them anymore. I love it I can play the old games from Nintendo and others. The first game I played was PONG back in the day. Nintendo Rocks!!!",1/7/23
"Awesome and Beautiful Nintendo Switch console It's good thing that was able to get Nintendo Switch for $299.99 few weeks ago and it arrived this week. Beautiful Nintendo Switch- Animal Crossing: New Horizon Special Edition console.It looks awesome with colors and design, and it works excellent at my home. I like that they have few free to play games and that they have SNES and NES games from Nintendo E-Shop. I can't wait to get Animal Crossing game someday. Hope they Add more free-to-play games on Nintendo Switch, add Twitch streaming app, and more apps for gamers, and be able to use bluetooth devices and console controllers with bluetooth.Hope they make more awesome and beautiful special editions designs and art Nintendo Switch consoles in the future and with 4k/8k graphics, audio, and UHD quality.Overall awesome console to own and have with my other different home consoles to play with my family and myself.",1/8/23
"The cutest! Needless to say, the Nintendo Switch is so much fun and a great way to kill time.  But on top of that, this particular console's Animal Crossing theme is just the cutest I've ever seen.  I never liked the primary-looking colors of the OG console, so the soft blue and mint green joy con colors really appealed to me.  The back of the switch itself has rivers and islands etched onto it as well!  It's the little details that really make a difference for me.  The dock is a light cream color with the raccoon travel agents on the bottom right.  I'm so glad this set was available again because, although I'm sure I'd be happy with the OG console, I'm so much happier with my Animal Crossing edition.  It makes me smile every time I see it.  I've never even played the game before I bought it, but it ended up being my first game purchase and it makes me even more happy that I bought this edition.  I love it!",1/7/23
"Really lives up to the hype. I couldn't afford to purchase this video game system for a good few years since money was tight while I was attending college. But, after saving up over the course of a few months, I became the proud owner of a Nintendo Switch system last year. And I gotta say... it really lives up to the hype.Being able to switch (no pun intended) between gaming on the TV and gaming in portable handheld mode has been a very nice, convenient gaming experience indeed. For example, it lets me take the game with me if I suddenly need to head into town with my family and I don't want to wait until I come back from town to continue my game. The games run very well and it gets great internet reception too (most of the time).I'm not sure I've ever had this much fun playing video games since Pokémon Ultra Moon on the 3DS. I'm definitely glad I ordered this game system. Very satisfied.",1/5/23
"Nice customer service I've had the light for a while, but it started drifting and playing animal crossing with a drift is no fun at all. Especially when u can't switch out the joycons I also wanted to start my island over so it was about time to get a new switch. As I was looking I was so lucky to see the animal crossing special edition back in stock and not at a scalping price. But at the normal price of 299.99, but when the first package was delivered it got stolen because Amazon delivery didn't know, customer service at first had an aditude with me. I had assume they didn't believe me that it was stolen. But it was and at the end of the day. Im so grateful they were able to replace the console with out Me having to get my money back because I saw that the price instantly jump from 299.99 to 360.00 which I would never recomend buying it at that price.",1/7/23
Best Nintendo Switch for $299.99 but Avoid Scalpers!!!!! This is the best switch for this year  I bought is at original price of 299.99 which is a great deal for this special animal crossing edition  worth the money  as you can see in the photos and video of unboxing everything is there and brand new I cant believe I have it. It was sold out everywhere but now thanks to my dad I have it for Christmas eve  when we open the gifts I Am so ecstatic and excited for Christmas eve thanks Nintendo for the best switch ever but it does not include the game  but that's ok because I already have it but if you are going to get this for your kids or for yourself for family fun avoid scalpers I hate them they suck also if you want  buy the switch and game itself it is a great game and I guarantee you will have a blast playing it,1/7/23
"Love my ACNH Nintendo Switch *_* We're Aussies living in Germany right now where the Animal Crossing Console ist still sold out so we bought it on Amazon US from Widget One LLC. Just make sure its a genuine company not a private person. We got the console for not more than the classic Nintendo Switch would cost including import fees and tax. We even got some import fees back from Amazon. And what can I say, I'm totally happy with the new Switch. Love the special Joy Cons, the special AC painting on the back and the special Animal Crossing Charging Station. I even got a Message in game from Animas crossing about the new special Joy Cons. The Animal Crossing Switch has the already new battery build in. I totally recommend to buy the switch if you're an Animal Crossing fan and don't have a switch already.",1/7/23
"The Nintendo Switch The Nintendo Switch if a one of a kind console or one might say a ""Handheld Console"". It is compatible with 3 different options which let you play by yourself or others on the go. Or the classic Nintendo way is to plug in it on the TV and play away.  People might say that it's not great and it's very small and does not process as well as the New Xbox X or the PS5. But it's not supposed to be like that. It's meant for the Nintendo games. You can't play any Mario game or Pokemon game without the switch. Every other console can't compare. There's a reason why it was never in the console wars. It doesn't have any competition in its class. It is by itself and is very unique. That's why I think the Nintendo Switch is one of a kind console and is very worth buying.",1/7/23
"Lots of fun and takes up very little space I've been wanting a Switch for a long time, so I finally went ahead and bought one; and it's been a lot of fun playing with it. I thought the controller would be a little awkward to play with, but it's easy to get the hang of. The only thing I can say is that it's not as ergonomic as an Xbox or even a PS controller, so if you're playing for long stretches of time, your hand will cramp up.I think that the biggest plus for me is how small this thing is - the entire console isn't much bigger than smartphones nowadays, and the games for it are half the size of DVDs. If you're fine with the limited game lineup and just want a console to kill time now and again, this is a great option. It's also not a big commitment space-wise.",1/7/23
"BEST NINTENDO CONSOLE! I've always loved Nintendo and every console that they've made but this one, really makes it to the top of my list! It's portable, light-weight and, pretty thin. Also, Amazon has a ton of cute cases to choose from so that you can bring your console for when you're on-the-go. The buttons feel comfortable to the slightest touch, everything feels smooth. Even the joysticks and trigger buttons have no resistance so there's no need to press them too hard. Easy to set up, there's a shop on the main menu for you to purchase games straight from your console and you can find people online to play with for your favorite Nintendo Switch games. I seriously love my Nintendo Switch and, everyone should get one today!",1/7/23
"Good Buy‼️ I purchased this system for my 3 year old son. It arrived earlier than expected brand new in the box. Although Animal crossing is to advanced for my son, ie. he can’t read the subtitles, I play the game and I love it. ( I’m 41) haha but you won’t be disappointed with the purchase. I also purchased a few other Nintendo switch games and enjoy them as well. One recommendation I would pass on is “not” buying the actual game cartridge but buying the downloadable version as you won’t worry about losing the tiny cartridge as my son did, but we later fixed them, I was upset at the thought of $60 dollars going down the drain as I should have bought the download so I wouldn’t have that issue. Enjoy ☺️",1/8/23
