Content,Date
"Great for younger kids or mobile gaming. This is, strangely enough, the first portable system I have ever bought in my 30+ years of gaming. I’ve actually bought 2 Switches so far. The first one was a Christmas present for my son who I was trying to ease into video games. He loves it. After him having it for a year and me occasionally playing it to help him through areas where my greater experience with games could help get through certain areas, I was tempted to get one for myself to play when I had long periods of downtime at work. When Witcher 3 came out for the switch, I bought another one for me and have been playing it a few times per week since.My experience with the console is pretty much strictly in the handheld mode. I bought a Satisfye grip and case for my switch which allows me to hold the system more comfortably than I would without it. Holding the standard system and playing for more that 20 minutes or so causes my hands to cramp. The small joycons are just too small for adult male hands to use for long without some discomfort. I’m fine with that since the small size makes the system easier for kids, like my son, to use. A regular controller can be a bit bulky for a grade school age kid to use well. With the case and grip, this system is perfect for me to throw into my vehicle at work and forget about it until things slow down when I’m waiting for a call. Then I can break it out and pass the time in style.All in all, I have no complaints about the system, my son loves it and uses it constantly. I like it for its portable nature and surprising computing power. It is the first portable system I’ve experienced that didn’t feel like a downgrade or gimmick. The Switch instead feels like a true portable version of a larger console like PS4 or XB1. I still play on my PS4 far more than I do the Switch, but I can’t take that system to work and play in the office or car. If you have young kids, or a desire to game on the go with something better than your phone, then it’s hard to go wrong with the switch.",1/6/23
"Love the Switch - A Casual Gamer's Best Console This is my review of the 'V2' (2019) version of the Nintendo Switch (model #HAC-001(-01)).So a little background, I was a enthusiastic PC gamer in college who built my own PCs for the purpose and am now - due to the demands of adulthood - someone who only plays the occasional game. My last handheld Nintendo console was the black and white Game Boy Pocket in the early 90's, so I've been away from the platform ---- a while.I bought the Switch purely because I learned they had ported Skyrim to it, and as a huge fan of the Elder Scrolls genre I was hoping to devote some of my train commute to questing around Tamriel. In this sense, the Switch does not disappoint. I am not a graphics connoisseur, but - compared to the PC version - Skryim plays really well on the Switch. No perceptible lag, colors are crisp. Yes, it's missing the expansions and yes, the text can be a little small, but that's a fair trade-off for the portability this platform brings.So far, I only own 2 games - Skyrim and MarioKart 8 (another throwback to my college dorm days on the N64), and I love playing both on the Switch, MaroKart is obviously the newer game and so the graphics and gameplay are much better but I'm a still a sucker for Skyrim (at least until the next ES is released, hopefully in my lifetime).Anyway, all this to say the Nintendo Switch is a great console for busy adults who want to reminisce about the fun they had 10, 20, or even 30 years ago. The Switch doesn't take itself too seriously (which I love) but that means it might not be the right choice for people concerned with the perfect graphic or gameplay experience - there are dedicated consoles that do this much better. What the Switch does is make gaming on the go effortless, fun for the average busy person and something you can really enjoy with your whole family - which I think was Nintendo's real goal here all along.",1/5/23
"Elegant compromise between handheld and console In terms of raw horsepower (CPU, graphics, whatever) the Nintendo Switch is far behind the current generation of consoles like the XBox One.  But, the Switch is a unique device.  As a handheld, it is quite powerful (the latest iteration nearly doubles the handheld's battery life, addressing the Switch's greatest weakness).  This allows you to play the same game on your TV and keep playing it as you take it out with you --- a unique ability.Most importantly, there is a staggering array of software available for it.  Software is what makes or breaks a console, no matter how good it is.For example the Zelda game ""Breath of the Wild"" is a visual stunner with a huge open world.  And this is the first portable system that has the full version of Skyrim available for it (the reason I bought it --- a high quality port of Skyrim with the 3 add-on packs).  Nintendo has also done high quality ports of other gems from older consoles such as ""Mario Kart 8"" as well as a lot of new titles such as ""Super Smash Brothers Ultimate"" or ""Luigi's Mansion 3"".In addition,their digital store has a lot of quality indie games such as Stardew Valley.Also, if you purchase the Nintendo Switch Online membership ($20/year) Nintendo also gives you a large selection of NES and SNES classic games.  The membership is worthwhile for that alone.Basically, because Nintendo is ONLY selling the Switch as a current console (the 3DS is on its way out), all of their best software goes to the one console.  And that gives developers strong incentives to bring their best titles over as well.If you want a wide variety of games, the Switch is a good choice.  If you want THE best console graphics or performance, obviously the Switch isn't for you.",1/7/23
"Such a cute switch! I love it! I couldn't believe my luck when I was able to snag one at MSRP after the release date. It's so cute! I like the design of this one much better than the other switches, and the dock is adorable, especially if you're an Animal Crossing fan. And it's the newer version with improved battery life, too! I was thinking about getting a switch for a while, but the lack of games I absolutely had to have and the colors (I'm not a big fan of the standard colors/designs) put me off. Animal Crossing solved both of these problems with ACNH and this amazing special edition.My only complaint (other than how difficult it was to get - finally caught a restock in the middle of the night and even that sold out in less than 5 minutes) is that sometimes one of the joycons gets stuck when trying to remove it from the strap. It's probably just an issue with mine in particular, but it does make it kind of annoying to remove. I have to put some force into it, and I'm sure that one of these days, I'll accidentally scratch myself trying to remove it. Otherwise, it's very cute, and at MSRP, I'd definitely choose it over the other colors!PS - I hear that this version is restocking, at least in Japan, so absolutely do not buy from scalpers! When I was hunting for this, there were at least 100 being sold by scalpers for ~$500;  now there are just over 20 for $750 each. It's cute, but it's not worth making a scalper $400+ off of other people's desperation. Just wait for a restock, or buy a regular switch and put a skin over it.",1/7/23
"Won my sisters heart! Alright so since the Covid-19 outbreak has officially ruined my sisters senior year she had started getting into animal crossing. After playing on the I Phone app for what felt like forever she decided she wanted to transition to a game on the 3ds console. Since she had started playing animal crossing new leaf she fell in love with the series. So as her big sister I had decided I would get her this limited edition themed switch in hopes of helping with her depression as well as to cheer her up for her senior year being ruined. Also so she could get a taste of Animal Crossing new horizons for when it comes out March 20th, 2020!  The day I told her I purchased it she hopped with joy. I was excited too considering I was sharing my own excitement for animal crossing with my sister. It had finally arrived. Its box didn't come in damaged and the console was packed safely to prevent possible damages. It works perfectly as any nintendo switch should with no defects at all in the console itself. The only concerns I have to remind future buyers is that the joycons will stop working properly after a year of use. This is coming from my own nintendo switch experiences and other fellow switch owners where the controls will drift randomly while you're trying to play a game after a year after consistant use. So I'd be best to invest in a second set of controllers just in case.All I have left to say is that this was indeed worth my money and my sister couldn't be happier with her early senior graduation gift!",1/7/23
"Be Patient! I got this Gray version of the Nintendo Switch after a few months of hunting for retail price $299. There's a couple of websites out there that will notify you of in-stock. I happened to be able to grab it off of Amazon, but GameStop, Target, Walmart, Best Buy, etc, also have them as well. With it being in stock is rare, so you just have to look and be patient! Plan a few months ahead for birthday / xmas gifts so you have time to wait for a retail priced stock is in. Enough about the INSANE price gouging....I am very pleased with the Switch and am very happy with it. I have played on it for a week so far and everything is working fine and dandy, as it should. One gripe is that the storage capacity is small so only a few games can be played at a time, but with a micro SD card, possibilities are endless. I ordered one of those, and expect it soon so I can expand my downloaded game collection. I've enjoyed the Switch so much I'm getting some additional joycons and a grip and a charging station. I'm going to continue looking for accessories. Maybe a case I also had to get a TV adapter because my old TV only has one HDMI port, so I had to RCA to HDMI it up in order to not unplug and replug my Roku every time I want a bigger screen. How that goes is yet to be determined.I'm still figuring out how the dock station works (TV debacle), but for the most part - no complaints! I haven't played it with more than one person yet, but I'm positive that runs smoothly as well!",1/7/23
"Nintendo Switch w/Grey joy cons V2 HAC-001(-01) This review is for the Nintendo Switch w/Grey joycons, V2 HAC-001(-01). I've owned the original Switch(HAC 001) and recently, the Switch Lite(Turquoise). Battery life wasn't so good with the original Switch and only a bit better with the Lite. This Switch model has improved battery life, up to 40% depending on brightness settings, volume settings, and the type of game you're playing. Another thing I've noticed is if you download digital games, it takes less time. The graphics(colors) seem to be more vibrant.If you're a gamer who likes to play games on the T.V exclusively, this would be the perfect choice. On the other hand,someone who enjoys gaming on the go, might find it cumbersome carrying this console around. It won't fit in your pocket. Just something to keep in mind.Lastly; if you buy plenty of digital games, a micro sd card of 32-128gb is a must. Another basic necessity would be a glass screen protector, as the plastic screen does scratch easily. There are two models, one with the grey joy cons and one with the red and blue joy cons. The Switch with the red and blue joy cons seems to be the rarer model and is sought after by gamers for it's resell value. There are plenty of games available for the Switch, something for everyoneand more to come. If you have your old Switch, it isn't really necessary to upgrade to this newer model. However; just for the improved battery life, I would recommend it.",1/7/23
"Situation Better than You May Think First of all, I wanna say that although Amazon may have some date when they say it will be in stock or some date when they say it’ll be delivered, just know that it may be earlier than anticipated. I ordered mine thinking it wasn’t gonna be here until  around June 4th, so about 3 weeks to a month after I ordered the switch, but fortunately, it came 2 weeks earlier! Apparently, I’m far from the only one who has experienced this, and a number of people have gotten their switch earlier than expected, so don’t look at the date thinking that’s when you’re gonna get it, ‘cause you may just get a nice surprise like a number of customers did. Yes, there are some stock issues with the switch at the moment as well as some production issues, but they are not as bad as they’re made out to be, so if you are thinking about getting the switch, go ahead and pull the trigger! Also, DO NOT BUY FRON SCALPERS. As some other people have mentioned, they will buy a switch and then sell it for a greater price than needed in order to make a profit, and although it may be tempting to buy from them so you can get it sooner, it is so not worth paying the extra money when the situation is actually better than amazon makes it out to be. Don’t do yourself a disservice and fall into the instant gratification trap. Be willing to wait a little bit longer for your switch. YOU’LL BE GLAD YOU DID.",1/7/23
"HIGHLY RECOMMEND THIS CONSOLE!!! I am not one to usually leave reviews on anything, but I just couldn’t pass up letting people know how awesome this console is. I have always loved Nintendo since I was a child. I had a 3DS & a Wii that I played religiously. I quit playing video games as I got into my late teen years, but my friend recently got a Switch & it encouraged me to dive back in. Let me start off by saying within 10 minutes of the Switch arriving, I already had it set up with my account connected and hooked up to my TV. So the setup process is a breeze. I put in the first game I bought for it, Mario Kart 8, it downloaded very quickly and it was like reliving my childhood all over again. Graphics are amazing and everything loads smoothly. The dock that comes with the Switch to connect it to your TV doubles as a charger for the device itself and the controllers. I bought an extra controller for it and all I had to do to connect it was use a USB cable hooked to the dock and plug the controller in. One of the biggest perks of this device is how you can alternate from handheld play to screen play. At home and wanna play games on your TV? Switch — Going on a flight and wanna have something to keep yourself entertained? Switch — All in all, a solid, quality device for a fair price. You won’t regret, nor can you go wrong with purchasing a Switch!!!",1/1/23
"Not Impressed I expected a bit more when it came to the Switch and I was a bit let down. First of all, I feel like the design is counter-intuitive especially the docking system. I don't understand why you need to place the entire tablet in-between such a cramped space where you could accidentally scratch up the device. There are so many bells and whistles that snap on and off it becomes rather annoying just to play a simple game. You can scratch up the joycons just by sliding them into the joycon grips. Why did you design it that way? The kickstand on the back of the Switch is a joke. It's so hard to open and isn't long enough to support the device. Also since, the power cord plug is directly under the device, you can't plug it in when you're using the kickstand. So many design irregularities and inconveniences. Fifty million buttons all over the place, which means fifty million ways to play one game and hold the controllers. It's so chaotic and annoying. Fun features such a streetpass and an internet browser are not on this device. This device still isn't powerful enough to compete with Playstation or Xbox. Just playing this device in your hand is a struggle because it is so freaking huge and weighty. I wouldn't buy this for a child, they can stick with the 3ds. To be honest, I had more fun playing on my 3ds and vita than the Switch.",1/8/23
"The Versatile and Fun Nintendo Switch: A Must-Have Gaming Console The Nintendo Switch is a fantastic gaming console that offers a unique and versatile gaming experience. The ability to play both at home on the TV and on the go in handheld mode is a huge plus, as it allows for gaming anytime and anywhere. The Switch's Joy-Con controllers are also a great feature, as they can be used separately for two-player games or attached to the console for handheld play.The Switch's game library is impressive, with a wide variety of games available, from first-party titles like ""The Legend of Zelda: Breath of the Wild"" and ""Super Mario Odyssey"", to third-party games like ""Minecraft"" and ""Fortnite"". The Switch also has a growing number of indie titles which are also worth checking out.The Switch's online service, Nintendo Switch Online, is also a good value, offering access to online multiplayer, cloud saves, and a growing library of classic NES and SNES games.Overall, the Nintendo Switch is a great choice for anyone looking for a versatile and fun gaming experience. It has a great selection of games, and the ability to play both at home and on the go makes it a great option for gaming on the go. The only downside might be that the battery life could be better, but overall it's an excellent device.",1/1/23
"This switch saved my marriage.. for now. This is my second purchase of a Nintendo Switch Animal Crossing edition. I was bummed out when my wife took my switch hostage claiming it for herself to play Animal Crossing, especially since Monster Hunter Rise had just come out. I was even more bummed out because I had missed out on buying the MHR switch edition because my rationale mind decided I didn’t need a second switch. I was left with 2 options, leave my wife & fight for custody of the switch or purchase another during the shortage brought by on by the epidemic. Surprisingly after a few months of contemplating my decision the switch prices went back down to an affordable price. It still wasn’t easy finding a switch in stores so I took to the internet where I was surprised to see a brand new switch going for regular price. I quickly added the item to my cart & purchased right away! It was delivered with upmost care like a stork bringing me a new baby. Everything was brand new, I was taken back to a simpler time in my life, opening presents on Christmas day. Finally after a quick software update I could play MHR months after its release! Little to my surprise my wife quit playing Animal Crossing shortly after I got my new switch because she went down Korean Drama rabbit hole on Netflix..",1/7/23
"Love the ACNH switch Call me crazy.....I bought the original switch a while ago and never played Animal Crossing before. When everyone was talking about New Horizon during the start of the Pandemic, I thought to give it a shot. Boy, I should not have done it :) I started spending all my free time paying off my loans to Tom Nook, hunting for villagers and trying to decorate my Island. Like many, I got kinda bored after everything was unlocked and got tired of the Villagers repeating the same over and over again. I thought of resetting my Island, but didn't want to lose everything I had worked for so hard. Then Nintendo announce to release the ACNH special edition switch again and beside I didn't like the idea of buying another switch, it was a great opportunity to start another Island with an ACNH themed switch. Anyway, I didn't regret spending another $299 - the switch is VERY cute and fits perfectly on my shelf. Beside still having my old switch with a developed, but basically abandoned  Island I mostly play on the new ACNH switch now. I know it's very hard to reset your Island, but if you don't have the money to buy another system, you may want to consider it. Starting from scratch actually  does bring a lot of the lost magic back.",1/7/23
"One of the Coolest Gaming Devices I’ve Owned The only time I’ve used a Switch has been playing on one that my friends own. Just these experiences has really intrigued me into getting my very own Switch. I love playing video games and I own an Xbox and PS4, so I figure at some point it was time to complete the trifecta. While I’m more of an Xbox person, I will say I am very impressed by the Switch. It is a very simple console, but genius in of itself. I’ve had some Nintendo gaming devices here and there. A SNES back in the day, but mostly their portable ones from the Gameboy to the Advanced to the DS and 3DS. The Switch combines that of a home console and a portable gaming device and for that I love it. I can put it in the dock and play it on my TV. I can play it handheld which will be great for road trips or maybe just wanting to play anywhere. This was a brilliant move by Nintendo and it makes the Switch really stand on its own.Now what I’d say my favorite thing about the console is it’s simplicity. This device is made for one thing only and that is for playing video games. The console is both modern and old school at the same time. Would definitely recommend to anyone who really likes Nintendo and their games.",1/7/23
" “can’t miss” for the casual gaming household Our household doesn’t buy the latest, greatest gaming systems but it was time to upgrade our original Wii for another family friendly system. The reviews were pretty glowing for the Switch and I can say they’re warranted. Just make sure you buy the newer generation (this product) so you have better battery life and less decline over the life of the product.I love how Nintendo the Parental Controls essentially live within an app on the parent’s phone. A motivated kid can hack just about anything so keeping these settings non-local is a brilliant little safeguard. My kids have to ask me for “more time” when they’ve hit a daily limit (which is customizable for the day of the week). It’s very much like a simpler, more reliable version of Apple’s Screen Time feature on iPhones. Of course, you can also unlock more time on the switch itself using a pin code.It’s also worth mentioning that Nintendo did a great job with the “user assisted driving” feature on Mario Kart that helps young kids and inexperienced gamers be competitive. It really is nice to bring my youngest daughter into the joy of Mario Karting.",1/7/23
"It’s good. Expensive, but good The titles and controls are too expensive for this platform. I really got this as another gaming option beside PC for more accessibility and Group fun. However, the individual joycons as controllers are unmanageable for most people I’ve tried to play with. I looked into buying more controllers to have more people play at the same time, or to give two-player sessions more comfort, but it’s just ridiculously expensive. Clearly, the remotes are not actually worth near what they charge for them. But when you add the little thing that you put the joycons in to make them a single controller, and a charging platform for the additional controllers, you’re looking at well over $100. Maybe I should have done more research. But for this amount of money, I could have set my pc up to double as a living room local-play gaming console and pay for BOTH AAA games AND low price indie games. It would have put me in a better position to start paving the way to a VR setup down the line.Setting all that aside, the quality of the games is good, the quality of the hardware is good, and the unique wired-to-handheld gimmick is nice.",1/2/23
"Product is great! Resellers... not so much! TLDR: Product is SO CUTE!! BUT doesn’t do anything special compared to a regular Switch (other than give 10/10 on aesthetic) so don’t buy unless you can afford it/the look it worth it to you.Long review:This product is amazing!! The pastel colors are so cute and the texture on the back adds a great extra touch. The dock has an AC graphic on it which was a great addition tomy living room! The packaging is also well thought out leading to a great unboxing experience. Of course this works exactly like every other Nintendo switch, so this is entirely about aesthetic.With all of that said, the price gouging on this product is insane. Because it is a limited edition the reselling price is crazy, and because it does nothing a normal Switch can’t do, so purchasing this is a novelty. If you have the cash to drop go for it (I was lucky enough to get one at the normal price). But as I was hunting one down when they were first announced, I watched people buy them up and list them at inflated prices before it even came out. So maybe consider if you want to give those people your money.",1/7/23
"Great! Slight problem. Amazing Console/handheld device! Don’t crap on the product in reviews but crap on the scalpers! Most of the reviews for switches that don’t work are probably people who’ve bought from 3rd party.I bought from SHIP & SOLD BY AMAZON. It came with little dust and packaging particles but I believe it was just from the warehouse storage that got into the hole the box has. I’ve been playing multiplayer for 2hrs now and it works perfectly fine! If you can wait, don’t buy 3rd party and do AMAZON. Totally worth it and really, really cute! I bought it MSRP btw ($299). No overpriced, scalped switch!Shipping: I bought it as a pre-order for the next month. It changed to arriving next week to this Sunday for me! There’s a chance it will be the same for you too! So if you can wait, be patient, look out for pre-orders (they are available every now and then) & buy it MSRP ($299)! It’ll be worth it!UPDATE AFTER 1 DAY:Just found out 1 vent on the back of the switch is loose and your able to push it in. I don’t know if this will be okay but review looses a star for this :(. Works great but slight defect.",1/7/23
