Content,Date
"Love the animal crossing design and the pastel colors for the joycons! If you're an Animal Crossing fan, then you'd enjoy adding this to your repertoire of consoles and games. I bought this last year and gave it away to one of my family members, but then I ended up missing it and decided I wanted it back, so I went and bought myself another one. I guess someone else must have really liked it too because unfortunately it was stolen after a few months of having it; now I have a 3rd Animal Crossing Switch console, and I love it so much. Definitely spend a good amount of time playing Animal Crossing New Horizons, Mario Kart 8, Fire Emblem Three Houses, Final Fantasy X/X-2 Remastered, etc. 110% Recommend",1/7/23
"Broken R button after 2-3 years of use Got this for Christmas in 2020, So I’m going into my 3rd years of using it, I just noticed that my R button was broken in half and don’t even know how that happened. It could of broken because of anything but you’d think since is only been using it a full 2 years that it wouldn’t break. I am very careful with it and have rarely dropped and usually have a case on it while in handheld mode. I’ve had some trouble with buttons but nothing that is too bad. I wasn’t expecting the R button to break like that though. It’s seems like it broke in half it still works but it’s not pleasing to the eye and is upsetting cause it just bothers me that it doesn’t look right.",1/3/23
"Left joy con controller stopped clicking.. just got it 3 days ago brand new Shipping was fast and on time, delivery guy was super nice as well. I got my switch never used, brand new and only had it for 3 days, the left joy con “left stick” won’t click. Im playing breath of the wild and I need that button to crouch in order to sneak in the game. Absolutely ridiculous that it stopped working that fast and I’ve been taking good care of it. I should have bought warranty with it and that’s my mistake I guess... But if anyone knows how to fix that I’m willing to do it myself before bringing it in to someone or buying all new controllers for it.",1/7/23
"Works Perfectly A large majority of the negative reviews are people complaining about the price when this product was being price gouged in 2020, but let me tell you, it’s a perfectly good price now.  System is sleek and easy to set up, making it a very stress-free situation.  Everything is well documented so that you can have the easiest time setting up your console.  Personally, I got the AC switch and it’s absolutely adorable!Only grief I have is that the console came a day early so I have to just let it sit for a day until I get my case, screen protector, and other games. Not the fault of anyone though",1/7/23
"Good, but problems The Nintendo Switch itself has worked ok. I am having issues with it not wanting to turn on today, but will come back to adjust review after I have done some troubleshooting. The problem I have with this one is the Japanese charging cord was included in it with the adapter for US. The adapter is loose and won't charge correctly. There were zero instructions on how to use this. I'm not sure that the charger even works (it keeps falling off the wall outlet because of the loose fit of the adapter). It would have been nice to have had the proper charging cable on something I paid $300 for.",1/5/23
"Great system overall The Switch is a great, versatile system. I bought one for my son two years ago for Christmas, and has gotten solid use for both of us. I went ahead and bought one for myself. The multiplayer games are un matched, Mario Kart 8, Super Smash Bros. The list of stellar multiplayer games goes on and on. For bang for your buck this is a great buy. Is it top of the line? No. Nintendo consoles are unique, and do their own thing. You won't be dissapointed, and neither will your kid. I bought him Miko 3 this past Christmas and guess what, he would rather play Switch.",1/1/23
"Stuck on logo screen I was really excited to buy this since I had a DS as a kid, but when a bought it a day later it was stuck on the logo screen. I tried to find solutions on the internet on how to fix this and I even tried sticking it in a freezer as a last resort. Still doesn’t work. It’s been 5 days I think? If it works I’ll let you know but honestly I’m really upset, it was expensive only for it to be unfunctional 1 or 2 days laterEDIT: it started working again I don’t know what exactly fixed it but I’m going to wait a while to see if it does it again",1/6/23
"Fantastic console. I bought this to upgrade my n64 and gamecube and although I was hesitant at first to buy it because the gameplay was almost identical to their legacy titles, it was a fantastic investment.  The console is much smaller to pack, the graphics are better, and it switches between a handheld device, a device you can setup on a table with 2 people, and a regular console you connect to a TV.  This is a truly timeless device that will always have value till the day I die.  You can use it for self entertainment or family game nights.",1/1/23
"Super cute Animal Crossing theme Got it for my sister-in-law for Christmas. She loves it! My brother bought her the Animal Crossing game to go with it, and she is totally infatuated!I have the original version, from when it first came out. My only complaint is that the dock quit charging. It still connects to the TV, just won't charge. Also, if you play Skyrim on it, everything is really dark. You have to brighten in system settings, and even then, you will need to use the ""Magelight"", or ""Candlelight"" spell to see dark areas.",1/4/23
"My favorite game!! I was planning on getting the new switch to play Animal Crossing on the big screen. My friends bf mentioned how there’s an Animal Crossing switch addition. I could not tell you how fast I was searching for this to be in stock somewhere. When I seen Amazon had it, I absolutely had to buy. Love everything about it. The silhouettes of the islands and villagers has to be my favorite. Anyone who has an Animal Crossing fan of their own or they themselves are huge fans, should absolutely get this hot buy.",1/7/23
 Nintendo Switch Review. So far I have no major complaints about the console that would stop me from using it. I don't have a home or TV so I can't say whether or not there are any problems connecting to a TV but I don't see why there would be. I am a fan of The Legend of Zelda and Metroid so I just have to have this console. There was the appearance of a half dollar sized spot under the screen that caused concern but after I removed the screen protector it disappeared. Like with any purchase anywhere use caution.,1/4/23
"Super fun! Love the colors! I love this system it takes some getting used to compared to the other consoles I have but nevertheless it's fun.  The only issue I have is the fact that my brand new console came with a scratch on the left joy-con.  I don't mind it, but I am just writing about it to let the company know that they should check their items before selling them to make sure no one else receives a slightly damaged product.  All in all I absolutely adore this system!  Thanks!",1/6/23
"Fun for everyone I'm so glad I bought this I have 3 children  14 , 9 , & 5.  2.  girls & a boy. We all have so much fun playing the different games together.  I also love the diversity of the controllers & game play. One of us can play on the TV or take it on the go , or all of us can play together  on the big screen  . It's so small & easy to set up I put all the stuff back in the box for safe keeping whenever we arnt playing it since it only takes 2 min to set it back up.",1/7/23
"Kids love this!!!!! My grandchildren had one switch console and were constantly fighting over who got to play first, so I bought this second one and they just love playing together now.  It charges up quickly and the battery lasts for days.  We took both switches on a vacation and the battery stayed charged until we got home 3 days later.  The games are all age appropriate and keep them entertained for hours.  This is one game system everyone in the house can enjoy.",1/7/23
 bit of trouble but worked out in the end This is the second one I had to order. The first one came defective and the charging dock was not working. Had some dust as if it was used before. It wouldn’t connect to my tv. It was my kids Xmas gift so they were sad when they couldn’t use it. I returned it waited about a week before getting a refund to re order. Once I received the second one I connected it and right away it transmitted signal to the tv.,1/7/23
Awesome system but battery life isnt great This is my first ever switch its a awesome system love it my only problem is that the battery only lasts a few hours so its always on the charger which makes it kinda lame as a handheld on the move not sure if its all or just the one i got has a bad battery but it be nice if it lasted atleast 8 + hours either way i recommend it.  it is one of the best game systems ever developed pretty ingenious,1/7/23
"Wife's Favorite Birthday Gift My wife absolutely loved receiving this as a birthday gift! She has been playing it a lot, because it's easy for her to use it while nursing our newborn daughter. The Animal Crossing decal on the Switch is really good quality and everything else about it has been great.There's not really much else to say, I mean, it's a Nintendo Switch. It is a really great console with lots of fun games to chose from!",1/7/23
"Item was late but as advertised and in good condition. While this item did arrive on 11/21 instead of 11/18 per the order, the item was as advertised and in good condition. The tracking provided was not helpful as it listed a lot of dates with “arrived at carrier facility” and “departed from carrier facility” no locations of any of these facilities were ever listed so I never knew how close it had come until it was delivered late.",1/5/23
super cute!!!! amazing!!! i love this nintendo soooo much!!!!! it is so cute and works just like all the newer ones! it came a week after i ordered it so really fast shipping. i was afraid it would get damaged during shipping but it was in perfect condition!! no regrets buying it!! if you are looking for a nintendo and you love animal crossing this is perfect!! even if you don’t like animal crossing it is still super cute!!!,1/4/23
Ehhh I got my switch used in good “very good condition” but when I put it in the dock after about 10 minutes it starts to make the tv screen flicker on and off and then eventually shut off I’m not if it’s the switch or my tv but I do have an Xbox connected as well and I do not have that problem with my Xbox so just be cautious buying from people who say it “works well” and if anybody knows what’s wrong please reply thank you,1/7/23
"Fun Just really like the ability to go from my TV screen to portable, don't gotta power down the device to do it, transition pretty quick, don't gotta shut down the game you are playing or anything. I am about 6 years late but with all the games on the store kinda surprised at lack of games actually interest me, but got enough to keep me satisfied and be able play fortnite easier when travel instead of packing my PS4.",1/3/23
" wonderful Valentine’s Day gift After reading the bad reviews from other buyers to the seller I was very worried about getting a refurbished console. What I get is a brand new Hong Kong version console and I don’t mind the console version, I am very happy with it. The downside is that this game console does not include the animial crossing game cassette, so you will need to purchase an additional one:)",1/2/23
Too many technical issues for only having had this 2 weeks We got this for Christmas a couple weeks ago and we consistently have had issues with the controllers. They would just go out randomly and we would have to reconnect. Not a huge deal just annoying. Today one of the controllers is just not being detected at all. For a brand new $300+$50/game console this is a problem. Poorly made cheap plastic.,1/7/23
"Came in packaged nicely with everything included. I was nervous to order a switch online as it’s expensive and the risk of damage but in my area they were sold out.Came in quickly without any issues, packaged safely and tightly. Had all the items it said were included, along with extra packaging when it came in. I’ve had mine for about 3 months now and I have had no issues with the switch or joycons.",1/3/23
"It is alright I have owned a Nintendo Wii and a Wii U and now the switch. The games I have: TMNT Cowabunga edition, Monopoly, Risk, Trival Pursuit and Super Mario Sparks of hope are good with excellent graphics and are fun to play but THIS IS NOT A BACKWARDS COMPATIBLE CONSOLE!  Also, the controllers are very small and can become uncomfortable to the hands after very long gameplay.",1/2/23
Mom vs. Child I bought this for my four year old but I think I been enjoying it more. We have been having a ball. I’m not huge on game systems but this is the perfect game system. From traveling and being busy i love that it goes from handheld to home console. Even when I can’t stop we can download games on the road on the system. It’s the perfect game system for the WHOLE FAMILY!,1/5/23
"Well worth the price. I play this an embarrassing number of hours every week. I love the design and I play on it often. Too often but what can I say? I love gaming. Great for handheld or playing with others on the big screen. would certainly recommend this to someone who loves playing games either alone, with family, or, if you purchase the online package, with complete strangers.",1/8/23
"Pricy . did not come with any games i like the features of the product .i like that it can be used on my Tv as well as a portable game . The games selection is great , however , it did nto come with any games laoded . i  had to spend an assitonal $60 just for one game . i woudl at least expect a gamign console to come with at leat one game considerignt hat this costs $299",1/7/23
"Great for a gift! My boyfriend bought me an animal crossing switch because he lost a bet, and I just couldn't see him without one, so the next day I got him a Switch and he was so happy to have one too. I know that it was a stupid impulse buy, but to be honest, it was worth it, I kind of play everyday, and he too so.. It would be a hassle to share just one switch.. xD",1/7/23
"Awesome I absolut3ly love the fact that it's not like the original switch colors. My daughter is extremely jealous because she got the original colors. The only thing I didn't like is that it wasn't made clear how to transfer save data from one console to the other. I thought I had transferred it correctly, but ended up having to start my game over because of this.",1/7/23
"Great switch, be sure to read the description first. Great switch.  Works well and does what it should.Was a little disappointed it does NOT include animal crossing, it just features some of the graphics...which you will pay extra for.  Had I known that we'd have gone with the standard colors.Outside of that overall happy with product.",1/6/23
"If you are a Nintendo fan, go for it I bought the system in order to play Nintendo's exclusive titles and I've been enjoying it so far. Maybe the only negative comment that I have for the system is that sometimes (very rarely) the joysticks get disconnected for no reason and the gaming experience is paused until they reconnect again.",1/4/23
"Really happy with purchase My son has been saving for a Nintendo switch for some time and was excited to be able to purchase. So far he has only played the free games online. He is 10 years old and loves it, easy to use, looks great. Good size, easy to use controls. Looking at online membership and games. Definitely recommend.",1/4/23
"Not a bundle!! Just an expensive paint job. No game included Was a gift from my granddaughter and she loves it, but she was devastated when it came without the game. I had to go to WA to the evil empire store and spend another $70 to get the actual game. Don’t call it a bundle if it’s just a special edition paint scheme.",1/4/23
"It's fun, $300 is the most you should pay though Had my switch since 2020. I don't personally use it a whole lot, but it is a good fun portable gaming console to have with you when youre out of the house. Battery life is decent too. It's good for kids who have good motor skills. It's not good for kids who are clumsy.",1/8/23
"Great little machine It’s been a while since I’ve owned a Nintendo, I’m normally an Xbox guy, but I’m super glad I’ve got this baby now. Huge dose of nostalgia plus portability, that’s awesome. Package was in great condition and so was everything inside. It works perfect now but I will update if anything changes.",1/7/23
"Love the Animal Crossing Colors! What can I say....its a Nintendo Switch! But the fact it has the Animal Crossing colors is a nice touch. The Switch has worked without issue since its purchase. While it does not see heavy used, it is used most days. I don't regret buying this edition of the Switch at all.",1/8/23
So beautiful! This switch is so beautiful! I’ve never seen one in real life before and it was so worth the wait! So far everything is working and I love love love it! No photos I can take will do the details or the beautiful colors justice! This was definitely worth the money spent and retail therapy!,1/4/23
Lots of Fun! I bought the Nintendo Switch for my grandchildren for CHRISTmas. It was easy to connect to my TV. Learning to use the controllers was a a breeze. The grandkids really enjoyed playing as well as my adult children. There have been no problems with it at all. I would buy it all over again.,1/4/23
Its a good system Im not a fan of the switch and prefer the original WII however my kids love this and have played on it a lot. They like that they can take it with them and not be confined to just using the TV. It was a good purchase and has never given us any issues. Ive had it almost 2 years.,1/5/23
Fun for all We love our Nintendo Switch. With winter on its way I know we will love it even more. My family lives a few hours away so its fun to be able to play games with them from afar. My husband and nephew were even able to play it together on a road trip we went on. It helped pass the time.,1/7/23
Great game system! Easy to set up! Great gift for our 8 year old. Love that we can set up to the tv and all the games u can get to go with! Charging is fast. And can be shared easily. You can buy extra controllers and more people can play on the tv! Such a cool little game system!,1/5/23
"loveee it no complaints about this order. it came to me brand new and nothing was missing. i love the color, it’s like how it is in the picture. i’ve been playing on it like everyday 😭. it doesn’t come with animal crossing though…i really only got it for the colors anyway lol",1/2/23
Works great daughter loves it I was concerned because it didn't arrive in it's original box but it works fine daughter loves it more than the switch OLED ..I just wish they would specify when something isn't coming in the original box but other than that..item is excellent 👌,1/5/23
My Brother loved it!!!! The item came well packaged and was not broken! It looked like it did in the pictures. It turned on and had no issue setting up. It was a gift for my brother for Christmas. He is very ecstatic about it! It works great! Thanks for a great product.,1/5/23
Great Product! The Nintendo Switch is such a great product. I bought it for my girlfriend who loves Animal Crossing and she plays it daily. She used to get mad at me for playing video games but now we can enjoy them together and spend quality time together.,1/1/23
" year later still good I bought this Nintendo, switch special edition for my youngest son’s birthday a little over a year ago still plays it’s going strong, and he’s pretty rush on stuff. This was his second personal gaming device the lite being his first.",1/5/23
"Nice device but After one use the R button broke.  My daughter was so upset and I think I paid too much for, I should get a percentage refunded to me. Do you know how difficult it has been to find replacement joy-con that match? I haven’t found one yet.",1/7/23
"My daughter loves it She’s been playing it all the time! Great to have games to go. Not sure what it has that her iPad doesn’t, but she seems happy. We got this because her brother moved back home into our media room which negated her access to the xbox",1/7/23
"Love it! I haven't had a video game console in a couple of years. I decided to try the switch. I am really enjoying using it. It is a lot of fun. Even though I'm out of practice using controllers, this has been very easy for me to pick up and use",1/3/23
"Cute, had to replace my old one What is with Nintendo and their batteries??? Had my old switch since launch and then the battery started to expand🤦Got this one to replace it lol what is funny is I don't play anima crossing😂 but it is cute👍🏻",1/7/23
"adorable everywhere console super cute design with so many awesome games available. I recommend the switch to everybody who is interested in gaming! plus this design is so adorable! and portable!!! easy 5 stars, I use mine every day.",1/8/23
We absolutely love this So many ways to play for all ages. It allows the user to download games. Parents can block certain functions while monitoring your child's usage remotely. Kind of pricy but was able to pay in installments.,1/5/23
"It's arlight Overall the console was easy to set up and very fun to play games on. But when downloading games it takes up too much space. And when buying more space it's very expensive. But besides that, it's very easy to use.",1/2/23
Expensive for refurbished Didn't realize until it was already purchased and in use that it is refurbished making it difficult to get any repairs.Silly to pay full price for a refurbished device!Otherwise works as expected,1/5/23
" waited for this moment Wait several months, I think years, for the Nintendo Switch to be at retail price ($299), the product arrived completely new and with the box with all the integrity.Yes, buy it, but at retail price",1/7/23
 love this so much! I had the gray version that came with mario kart 8 previously with an ex boyfriend but he took it so decided to get a new one and loved this one so much. Came quickly and my boyfriend uses it a lot!,1/7/23
"LATE but worth it. Nothing wrong with this. Just if you order it, usps is shady and they ""lost"" my package. Suggest sending it to a Amazon hub or locker. They finally ""found"" it hiding. And box was open. So yeah.",1/5/23
" love it, but not a lot of storage Personally when I was downloading games, the space fills up fast to where you are gonna have to buy games, but other than that it is a great addition to my console collection!",1/3/23
"Kids love it! Bought for my daughters for Christmas and they love it! Easy set up! Durable! All around a good value, but for the price paid it would have been nice to have one or two preloaded games to start.",1/4/23
"Doesn't come with the game Purchased the Animal crossing style for my daughter, thinking it would have the game with it. Nope. They wabt you to pay 50 dollars more to get the game to go with the style. Crazy.",1/6/23
"Surprise. International charger. Bought the gray one, and it did not come with a US charging cord. Although they tossed in an adapter.. but not for the US. It was the thought that counts I guess…",1/7/23
Works great! I got this for my boyfriend for Christmas. He uses it just about everyday and absolutely loves it. It stays charged for a decent amount of time. It hasn’t given us any problems!,1/3/23
Cutest Switch ever Literally was waiting and waiting for it to be in sick again after the first run. I'm in love. The design is the cutest and it's so perfect for the Animal Crossing theme.,1/7/23
"It's a switch !! I had been saving up for it after having a switch lite for a year or 2 and it works great, looks great, and works amazingly !! very excited to stream pokemon and such hehe",1/5/23
"European model Came with a European power cord. Thankfully we had a replacement on hand but that was pretty disappointing.  Otherwise, it's been working great and my kids are so excited.",1/5/23
"Just what I was looking for Was looking for Animal Crossing Switch, came across this one.  Shipping was super fast.  Everything looks good.  We will not open this until Christmas though.",1/6/23
great product I love that Nintendo has created something that gives all the nostalgic feelings to adults as well as introducing these great characters to kids. Just a game system.,1/7/23
"Amazing Console. I seem to have been 5years too late getting myself a Nintendo Switch. But, I have one now. The concept is amazing. I wish I had gotten myself one much earlier.",1/7/23
In good condition; SD Card not working; Missing Joy-con Straps The switch is in good condition; the SD Card it came with is not working; The box is missing the Joy-con Straps.,1/5/23
Needed extra data.. Bought this for my son. It can preloaded with a game.  The only issue is it didn’t have enough space to put another game in it. I was unaware of this.,1/5/23
"Great deal! Love the switch and the added Mario game.  Hooked it up as soon as I got it. Paired with the annual membership,I was able to play the old games from the 90s!",1/2/23
Tv? Occasionally when I try to connect it to my TV it acts like nothing is there and if not that I Occasionally have problems getting both remotes to connect as player 1,1/2/23
